cwe|name|description
CWE-1004|Sensitive Cookie Without HttpOnly Flag|The software uses a cookie to store sensitive information
CWE-1007|Insufficient Visual Distinction of Homoglyphs Presented to User|The software displays information or identifiers to a user
CWE-102|Struts: Duplicate Validation Forms|The application uses multiple validation forms with the same name
CWE-1021|Improper Restriction of Rendered UI Layers or Frames|The web application does not restrict or incorrectly restricts frame objects or UI layers that belong to another application or domain
CWE-1022|Improper Restriction of Cross-Origin Permission to window.opener.location|The web application does not restrict or incorrectly restricts modification of its window opener objects location property by an external application from a different origin.
CWE-103|Struts: Incomplete validate() Method Definition|The application has a validator form that either does not define a validate() method
CWE-104|Struts: Form Bean Does Not Extend Validation Class|If a form bean does not extend an ActionForm subclass of the Validator framework
CWE-105|Struts: Form Field Without Validator|The application has a form field that is not validated by a corresponding validation form
CWE-106|Struts: Plug-in Framework not in Use|When an application does not use an input validation framework such as the Struts Validator
CWE-107|Struts: Unused Validation Form|An unused validation form indicates that validation logic is not up-to-date.
CWE-108|Struts: Unvalidated Action Form|Every Action Form must have a corresponding validation form.
CWE-109|Struts: Validator Turned Off|Automatic filtering via a Struts bean has been turned off
CWE-11|ASP.NET Misconfiguration: Creating Debug Binary|Debugging messages help attackers learn about the system and plan a form of attack.
CWE-110|Struts: Validator Without Form Field|Validation fields that do not appear in forms they are associated with indicate that the validation logic is out of date.
CWE-111|Direct Use of Unsafe JNI|When a Java application uses the Java Native Interface (JNI) to call code written in another programming language
CWE-112|Missing XML Validation|The software accepts XML from an untrusted source but does not validate the XML against the proper schema.
CWE-113|Improper Neutralization of CRLF Sequences in HTTP Headers (HTTP Response Splitting)|The software receives data from an upstream component
CWE-114|Process Control|Executing commands or loading libraries from an untrusted source or in an untrusted environment can cause an application to execute malicious commands (and payloads) on behalf of an attacker.
CWE-115|Misinterpretation of Input|The software misinterprets an input
CWE-116|Improper Encoding or Escaping of Output|The software prepares a structured message for communication with another component
CWE-117|Improper Output Neutralization for Logs|The software does not neutralize or incorrectly neutralizes output that is written to logs.
CWE-118|Incorrect Access of Indexable Resource (Range Error)|The software does not restrict or incorrectly restricts operations within the boundaries of a resource that is accessed using an index or pointer
CWE-119|Improper Restriction of Operations within the Bounds of a Memory Buffer|The software performs operations on a memory buffer
CWE-12|ASP.NET Misconfiguration: Missing Custom Error Page|An ASP .NET application must enable custom error pages in order to prevent attackers from mining information from the frameworks built-in responses.
CWE-120|Buffer Copy without Checking Size of Input (Classic Buffer Overflow)|The program copies an input buffer to an output buffer without verifying that the size of the input buffer is less than the size of the output buffer
CWE-121|Stack-based Buffer Overflow|A stack-based buffer overflow condition is a condition where the buffer being overwritten is allocated on the stack (i.e.
CWE-122|Heap-based Buffer Overflow|A heap overflow condition is a buffer overflow
CWE-123|Write-what-where Condition|Any condition where the attacker has the ability to write an arbitrary value to an arbitrary location
CWE-124|Buffer Underwrite (Buffer Underflow)|The software writes to a buffer using an index or pointer that references a memory location prior to the beginning of the buffer.
CWE-125|Out-of-bounds Read|The software reads data past the end
CWE-126|Buffer Over-read|The software reads from a buffer using buffer access mechanisms such as indexes or pointers that reference memory locations after the targeted buffer.
CWE-127|Buffer Under-read|The software reads from a buffer using buffer access mechanisms such as indexes or pointers that reference memory locations prior to the targeted buffer.
CWE-128|Wrap-around Error|Wrap around errors occur whenever a value is incremented past the maximum value for its type and therefore wraps around to a very small
CWE-129|Improper Validation of Array Index|The product uses untrusted input when calculating or using an array index
CWE-13|ASP.NET Misconfiguration: Password in Configuration File|Storing a plaintext password in a configuration file allows anyone who can read the file access to the password-protected resource making them an easy target for attackers.
CWE-130|Improper Handling of Length Parameter Inconsistency |The software parses a formatted message or structure
CWE-131|Incorrect Calculation of Buffer Size|The software does not correctly calculate the size to be used when allocating a buffer
CWE-134|Use of Externally-Controlled Format String|The software uses a function that accepts a format string as an argument
CWE-135|Incorrect Calculation of Multi-Byte String Length|The software does not correctly calculate the length of strings that can contain wide or multi-byte characters.
CWE-138|Improper Neutralization of Special Elements|The software receives input from an upstream component
CWE-14|Compiler Removal of Code to Clear Buffers|Sensitive memory is cleared according to the source code
CWE-140|Improper Neutralization of Delimiters|The software does not neutralize or incorrectly neutralizes delimiters.
CWE-141|Improper Neutralization of Parameter/Argument Delimiters|The software receives input from an upstream component
CWE-142|Improper Neutralization of Value Delimiters|The software receives input from an upstream component
CWE-143|Improper Neutralization of Record Delimiters|The software receives input from an upstream component
CWE-144|Improper Neutralization of Line Delimiters|The software receives input from an upstream component
CWE-145|Improper Neutralization of Section Delimiters|The software receives input from an upstream component
CWE-146|Improper Neutralization of Expression/Command Delimiters|The software receives input from an upstream component
CWE-147|Improper Neutralization of Input Terminators|The software receives input from an upstream component
CWE-148|Improper Neutralization of Input Leaders|The application does not properly handle when a leading character or sequence (leader) is missing or malformed
CWE-149|Improper Neutralization of Quoting Syntax|Quotes injected into an application can be used to compromise a system. As data are parsed
CWE-15|External Control of System or Configuration Setting|One or more system settings or configuration elements can be externally controlled by a user.
CWE-150|Improper Neutralization of Escape|Variant
CWE-151|Improper Neutralization of Comment Delimiters|The software receives input from an upstream component
CWE-152|Improper Neutralization of Macro Symbols|The software receives input from an upstream component
CWE-153|Improper Neutralization of Substitution Characters|The software receives input from an upstream component
CWE-154|Improper Neutralization of Variable Name Delimiters|The software receives input from an upstream component
CWE-155|Improper Neutralization of Wildcards or Matching Symbols|The software receives input from an upstream component
CWE-156|Improper Neutralization of Whitespace|The software receives input from an upstream component
CWE-157|Failure to Sanitize Paired Delimiters|The software does not properly handle the characters that are used to mark the beginning and ending of a group of entities
CWE-158|Improper Neutralization of Null Byte or NUL Character|The software receives input from an upstream component
CWE-159|Failure to Sanitize Special Element|Weaknesses in this attack-focused category do not properly filter and interpret special elements in user-controlled input which could cause adverse effect on the software behavior and integrity.
CWE-160|Improper Neutralization of Leading Special Elements|The software receives input from an upstream component
CWE-161|Improper Neutralization of Multiple Leading Special Elements|The software receives input from an upstream component
CWE-162|Improper Neutralization of Trailing Special Elements|The software receives input from an upstream component
CWE-163|Improper Neutralization of Multiple Trailing Special Elements|The software receives input from an upstream component
CWE-164|Improper Neutralization of Internal Special Elements|The software receives input from an upstream component
CWE-165|Improper Neutralization of Multiple Internal Special Elements|The software receives input from an upstream component
CWE-166|Improper Handling of Missing Special Element|The software receives input from an upstream component
CWE-167|Improper Handling of Additional Special Element|The software receives input from an upstream component
CWE-168|Improper Handling of Inconsistent Special Elements|The software does not handle when an inconsistency exists between two or more special characters or reserved words.
CWE-170|Improper Null Termination|The software does not terminate or incorrectly terminates a string or array with a null character or equivalent terminator.
CWE-172|Encoding Error|The software does not properly encode or decode the data
CWE-173|Improper Handling of Alternate Encoding|The software does not properly handle when an input uses an alternate encoding that is valid for the control sphere to which the input is being sent.
CWE-174|Double Decoding of the Same Data|The software decodes the same input twice
CWE-175|Improper Handling of Mixed Encoding|The software does not properly handle when the same input uses several different (mixed) encodings.
CWE-176|Improper Handling of Unicode Encoding|The software does not properly handle when an input contains Unicode encoding.
CWE-177|Improper Handling of URL Encoding (Hex Encoding)|The software does not properly handle when all or part of an input has been URL encoded.
CWE-178|Improper Handling of Case Sensitivity|The software does not properly account for differences in case sensitivity when accessing or determining the properties of a resource
CWE-179|Incorrect Behavior Order: Early Validation|The software validates input before applying protection mechanisms that modify the input
CWE-180|Incorrect Behavior Order: Validate Before Canonicalize|The software validates input before it is canonicalized
CWE-181|Incorrect Behavior Order: Validate Before Filter|The software validates data before it has been filtered
CWE-182|Collapse of Data into Unsafe Value|The software filters data in a way that causes it to be reduced or collapsed into an unsafe value that violates an expected security property.
CWE-183|Permissive Whitelist|An application uses a whitelist of acceptable values
CWE-184|Incomplete Blacklist|An application uses a blacklist of prohibited values
CWE-185|Incorrect Regular Expression|The software specifies a regular expression in a way that causes data to be improperly matched or compared.
CWE-186|Overly Restrictive Regular Expression|A regular expression is overly restrictive
CWE-187|Partial Comparison|The software performs a comparison that only examines a portion of a factor before determining whether there is a match
CWE-188|Reliance on Data/Memory Layout|The software makes invalid assumptions about how protocol data or memory is organized at a lower level
CWE-190|Integer Overflow or Wraparound|The software performs a calculation that can produce an integer overflow or wraparound
CWE-191|Integer Underflow (Wrap or Wraparound)|The product subtracts one value from another
CWE-192|Integer Coercion Error|Integer coercion refers to a set of flaws pertaining to the type casting
CWE-193|Off-by-one Error|A product calculates or uses an incorrect maximum or minimum value that is 1 more
CWE-194|Unexpected Sign Extension|The software performs an operation on a number that causes it to be sign extended when it is transformed into a larger data type. When the original number is negative
CWE-195|Signed to Unsigned Conversion Error|The software uses a signed primitive and performs a cast to an unsigned primitive
CWE-196|Unsigned to Signed Conversion Error|The software uses an unsigned primitive and performs a cast to a signed primitive
CWE-197|Numeric Truncation Error|Truncation errors occur when a primitive is cast to a primitive of a smaller size and data is lost in the conversion.
CWE-198|Use of Incorrect Byte Ordering|The software receives input from an upstream component
CWE-20|Improper Input Validation|The product does not validate or incorrectly validates input that can affect the control flow or data flow of a program.
CWE-200|Information Exposure|An information exposure is the intentional or unintentional disclosure of information to an actor that is not explicitly authorized to have access to that information.
CWE-201|Information Exposure Through Sent Data|The accidental exposure of sensitive information through sent data refers to the transmission of data which are either sensitive in and of itself or useful in the further exploitation of the system through standard data channels.
CWE-202|Exposure of Sensitive Data Through Data Queries|When trying to keep information confidential
CWE-203|Information Exposure Through Discrepancy|The product behaves differently or sends different responses in a way that exposes security-relevant information about the state of the product
CWE-204|Response Discrepancy Information Exposure|The software provides different responses to incoming requests in a way that allows an actor to determine system state information that is outside of that actors control sphere.
CWE-205|Information Exposure Through Behavioral Discrepancy|The products actions indicate important differences based on (1) the internal state of the product or (2) differences from other products in the same class.
CWE-206|Information Exposure of Internal State Through Behavioral Inconsistency|Two separate operations in a product cause the product to behave differently in a way that is observable to an attacker and reveals security-relevant information about the internal state of the product
CWE-207|Information Exposure Through an External Behavioral Inconsistency|The product behaves differently than other products like it
CWE-208|Information Exposure Through Timing Discrepancy|Two separate operations in a product require different amounts of time to complete
CWE-209|Information Exposure Through an Error Message|The software generates an error message that includes sensitive information about its environment
CWE-210|Information Exposure Through Self-generated Error Message|The software identifies an error condition and creates its own diagnostic or error messages that contain sensitive information.
CWE-211|Information Exposure Through Externally-Generated Error Message|The software performs an operation that triggers an external diagnostic or error message that is not directly generated by the software
CWE-212|Improper Cross-boundary Removal of Sensitive Data|The software uses a resource that contains sensitive data
CWE-213|Intentional Information Exposure|A products design or configuration explicitly requires the publication of information that could be regarded as sensitive by an administrator.
CWE-214|Information Exposure Through Process Environment|A process is invoked with sensitive arguments
CWE-215|Information Exposure Through Debug Information|The application contains debugging code that can expose sensitive information to untrusted parties.
CWE-216|Containment Errors (Container Errors)|This tries to cover various problems in which improper data are included within a container.
CWE-219|Sensitive Data Under Web Root|The application stores sensitive data under the web document root with insufficient access control
CWE-22|Improper Limitation of a Pathname to a Restricted Directory (Path Traversal)|The software uses external input to construct a pathname that is intended to identify a file or directory that is located underneath a restricted parent directory
CWE-220|Sensitive Data Under FTP Root|The application stores sensitive data under the FTP document root with insufficient access control
CWE-221|Information Loss or Omission|The software does not record
CWE-222|Truncation of Security-relevant Information|The application truncates the display
CWE-223|Omission of Security-relevant Information|The application does not record or display information that would be important for identifying the source or nature of an attack
CWE-224|Obscured Security-relevant Information by Alternate Name|The software records security-relevant information according to an alternate name of the affected entity
CWE-226|Sensitive Information Uncleared Before Release|The software does not fully clear previously used information in a data structure
CWE-228|Improper Handling of Syntactically Invalid Structure|The product does not handle or incorrectly handles input that is not syntactically well-formed with respect to the associated specification.
CWE-229|Improper Handling of Values|The software does not properly handle when the expected number of values for parameters
CWE-23|Relative Path Traversal|The software uses external input to construct a pathname that should be within a restricted directory
CWE-230|Improper Handling of Missing Values|The software does not handle or incorrectly handles when a parameter
CWE-231|Improper Handling of Extra Values|The software does not handle or incorrectly handles when more values are provided than expected.
CWE-232|Improper Handling of Undefined Values|The software does not handle or incorrectly handles when a value is not defined or supported for the associated parameter
CWE-233|Improper Handling of Parameters|The software does not properly handle when the expected number of parameters
CWE-234|Failure to Handle Missing Parameter|If too few arguments are sent to a function
CWE-235|Improper Handling of Extra Parameters|The software does not handle or incorrectly handles when the number of parameters
CWE-236|Improper Handling of Undefined Parameters|The software does not handle or incorrectly handles when a particular parameter
CWE-237|Improper Handling of Structural Elements|The software does not handle or incorrectly handles inputs that are related to complex structures.
CWE-238|Improper Handling of Incomplete Structural Elements|The software does not handle or incorrectly handles when a particular structural element is not completely specified.
CWE-239|Failure to Handle Incomplete Element|The software does not properly handle when a particular element is not completely specified.
CWE-24|Path Traversal: ../filedir|The software uses external input to construct a pathname that should be within a restricted directory
CWE-240|Improper Handling of Inconsistent Structural Elements|The software does not handle or incorrectly handles when two or more structural elements should be consistent
CWE-241|Improper Handling of Unexpected Data Type|The software does not handle or incorrectly handles when a particular element is not the expected type
CWE-242|Use of Inherently Dangerous Function|The program calls a function that can never be guaranteed to work safely.
CWE-243|Creation of chroot Jail Without Changing Working Directory|The program uses the chroot() system call to create a jail
CWE-244|Improper Clearing of Heap Memory Before Release (Heap Inspection)|Using realloc() to resize buffers that store sensitive information can leave the sensitive information exposed to attack
CWE-245|J2EE Bad Practices: Direct Management of Connections|The J2EE application directly manages connections
CWE-246|J2EE Bad Practices: Direct Use of Sockets|The J2EE application directly uses sockets instead of using framework method calls.
CWE-248|Uncaught Exception|An exception is thrown from a function
CWE-25|Path Traversal: /../filedir|The software uses external input to construct a pathname that should be within a restricted directory
CWE-250|Execution with Unnecessary Privileges|The software performs an operation at a privilege level that is higher than the minimum level required
CWE-252|Unchecked Return Value|The software does not check the return value from a method or function
CWE-253|Incorrect Check of Function Return Value|The software incorrectly checks a return value from a function
CWE-256|Plaintext Storage of a Password|Storing a password in plaintext may result in a system compromise.
CWE-257|Storing Passwords in a Recoverable Format|The storage of passwords in a recoverable format makes them subject to password reuse attacks by malicious users. In fact
CWE-258|Empty Password in Configuration File|Using an empty string as a password is insecure.
CWE-259|Use of Hard-coded Password|The software contains a hard-coded password
CWE-26|Path Traversal: /dir/../filename|The software uses external input to construct a pathname that should be within a restricted directory
CWE-260|Password in Configuration File|The software stores a password in a configuration file that might be accessible to actors who do not know the password.
CWE-261|Weak Cryptography for Passwords|Obscuring a password with a trivial encoding does not protect the password.
CWE-262|Not Using Password Aging|If no mechanism is in place for managing password aging
CWE-263|Password Aging with Long Expiration|Allowing password aging to occur unchecked can result in the possibility of diminished password integrity.
CWE-266|Incorrect Privilege Assignment|A product incorrectly assigns a privilege to a particular actor
CWE-267|Privilege Defined With Unsafe Actions|A particular privilege
CWE-268|Privilege Chaining|Two distinct privileges
CWE-269|Improper Privilege Management|The software does not properly assign
CWE-27|Path Traversal: dir/../../filename|The software uses external input to construct a pathname that should be within a restricted directory
CWE-270|Privilege Context Switching Error|The software does not properly manage privileges while it is switching between different contexts that have different privileges or spheres of control.
CWE-271|Privilege Dropping / Lowering Errors|The software does not drop privileges before passing control of a resource to an actor that does not have those privileges.
CWE-272|Least Privilege Violation|The elevated privilege level required to perform operations such as chroot() should be dropped immediately after the operation is performed.
CWE-273|Improper Check for Dropped Privileges|The software attempts to drop privileges but does not check or incorrectly checks to see if the drop succeeded.
CWE-274|Improper Handling of Insufficient Privileges|The software does not handle or incorrectly handles when it has insufficient privileges to perform an operation
CWE-276|Incorrect Default Permissions|The software
CWE-277|Insecure Inherited Permissions|A product defines a set of insecure permissions that are inherited by objects that are created by the program.
CWE-278|Insecure Preserved Inherited Permissions|A product inherits a set of insecure permissions for an object
CWE-279|Incorrect Execution-Assigned Permissions|While it is executing
CWE-28|Path Traversal: ..filedir|The software uses external input to construct a pathname that should be within a restricted directory
CWE-280|Improper Handling of Insufficient Permissions or Privileges |The application does not handle or incorrectly handles when it has insufficient privileges to access resources or functionality as specified by their permissions. This may cause it to follow unexpected code paths that may leave the application in an invalid state.
CWE-281|Improper Preservation of Permissions|The software does not preserve permissions or incorrectly preserves permissions when copying
CWE-282|Improper Ownership Management|The software assigns the wrong ownership
CWE-283|Unverified Ownership|The software does not properly verify that a critical resource is owned by the proper entity.
CWE-284|Improper Access Control|The software does not restrict or incorrectly restricts access to a resource from an unauthorized actor.
CWE-285|Improper Authorization|The software does not perform or incorrectly performs an authorization check when an actor attempts to access a resource or perform an action.
CWE-286|Incorrect User Management|The software does not properly manage a user within its environment.
CWE-287|Improper Authentication|When an actor claims to have a given identity
CWE-288|Authentication Bypass Using an Alternate Path or Channel|A product requires authentication
CWE-289|Authentication Bypass by Alternate Name|The software performs authentication based on the name of a resource being accessed
CWE-29|Path Traversal: ..filename|The software uses external input to construct a pathname that should be within a restricted directory
CWE-290|Authentication Bypass by Spoofing|This attack-focused weakness is caused by improperly implemented authentication schemes that are subject to spoofing attacks.
CWE-291|Reliance on IP Address for Authentication|The software uses an IP address for authentication.
CWE-293|Using Referer Field for Authentication|The referer field in HTTP requests can be easily modified and
