cwe|name|description
CWE-473|PHP External Variable Modification|A PHP application does not properly protect against the modification of variables from external sources
CWE-474|Use of Function with Inconsistent Implementations|The code uses a function that has inconsistent implementations across operating systems and versions.
CWE-475|Undefined Behavior for Input to API|The behavior of this function is undefined unless its control parameter is set to a specific value.
CWE-476|NULL Pointer Dereference|A NULL pointer dereference occurs when the application dereferences a pointer that it expects to be valid
CWE-477|Use of Obsolete Function|The code uses deprecated or obsolete functions
CWE-478|Missing Default Case in Switch Statement|The code does not have a default case in a switch statement
CWE-479|Signal Handler Use of a Non-reentrant Function|The program defines a signal handler that calls a non-reentrant function.
CWE-48|Path Equivalence: file name (Internal Whitespace)|A software system that accepts path input in the form of internal space (file(SPACE)name) without appropriate validation can lead to ambiguous path resolution and allow an attacker to traverse the file system to unintended locations or access arbitrary files.
CWE-480|Use of Incorrect Operator|The programmer accidentally uses the wrong operator
CWE-481|Assigning instead of Comparing|The code uses an operator for assignment when the intention was to perform a comparison.
CWE-482|Comparing instead of Assigning|The code uses an operator for comparison when the intention was to perform an assignment.
CWE-483|Incorrect Block Delimitation|The code does not explicitly delimit a block that is intended to contain 2 or more statements
CWE-484|Omitted Break Statement in Switch|The program omits a break statement within a switch or similar construct
CWE-486|Comparison of Classes by Name|The program compares classes by name
CWE-487|Reliance on Package-level Scope|Java packages are not inherently closed; therefore
CWE-488|Exposure of Data Element to Wrong Session|The product does not sufficiently enforce boundaries between the states of different sessions
CWE-489|Leftover Debug Code|The application can be deployed with active debugging code that can create unintended entry points.
CWE-49|Path Equivalence: filename/ (Trailing Slash)|A software system that accepts path input in the form of trailing slash (filedir/) without appropriate validation can lead to ambiguous path resolution and allow an attacker to traverse the file system to unintended locations or access arbitrary files.
CWE-491|Public cloneable() Method Without Final (Object Hijack)|A class has a cloneable() method that is not declared final
CWE-492|Use of Inner Class Containing Sensitive Data|Inner classes are translated into classes that are accessible at package scope and may expose code that the programmer intended to keep private to attackers.
CWE-493|Critical Public Variable Without Final Modifier|The product has a critical public variable that is not final
CWE-494|Download of Code Without Integrity Check|The product downloads source code or an executable from a remote location and executes the code without sufficiently verifying the origin and integrity of the code.
CWE-495|Private Array-Typed Field Returned From A Public Method|The product has a method that is declared public
CWE-496|Public Data Assigned to Private Array-Typed Field|Assigning public data to a private array is equivalent to giving public access to the array.
CWE-497|Exposure of System Data to an Unauthorized Control Sphere|Exposing system data or debugging information helps an adversary learn about the system and form an attack plan.
CWE-498|Cloneable Class Containing Sensitive Information|The code contains a class with sensitive data
CWE-499|Serializable Class Containing Sensitive Data|The code contains a class with sensitive data
CWE-5|J2EE Misconfiguration: Data Transmission Without Encryption|Information sent over a network can be compromised while in transit. An attacker may be able to read or modify the contents if the data are sent in plaintext or are weakly encrypted.
CWE-50|Path Equivalence: //multiple/leading/slash|A software system that accepts path input in the form of multiple leading slash (//multiple/leading/slash) without appropriate validation can lead to ambiguous path resolution and allow an attacker to traverse the file system to unintended locations or access arbitrary files.
CWE-500|Public Static Field Not Marked Final|An object contains a public static field that is not marked final
CWE-501|Trust Boundary Violation|The product mixes trusted and untrusted data in the same data structure or structured message.
CWE-502|Deserialization of Untrusted Data|The application deserializes untrusted data without sufficiently verifying that the resulting data will be valid.
CWE-506|Embedded Malicious Code|The application contains code that appears to be malicious in nature.
CWE-507|Trojan Horse|The software appears to contain benign or useful functionality
CWE-508|Non-Replicating Malicious Code|Non-replicating malicious code only resides on the target system or software that is attacked; it does not attempt to spread to other systems.
CWE-509|Replicating Malicious Code (Virus or Worm)|Replicating malicious code
CWE-51|Path Equivalence: /multiple//internal/slash|A software system that accepts path input in the form of multiple internal slash (/multiple//internal/slash/) without appropriate validation can lead to ambiguous path resolution and allow an attacker to traverse the file system to unintended locations or access arbitrary files.
CWE-510|Trapdoor|A trapdoor is a hidden piece of code that responds to a special input
CWE-511|Logic/Time Bomb|The software contains code that is designed to disrupt the legitimate operation of the software (or its environment) when a certain time passes
CWE-512|Spyware|The software collects personally identifiable information about a human user or the users activities
CWE-514|Covert Channel|A covert channel is a path that can be used to transfer information in a way not intended by the systems designers.
CWE-515|Covert Storage Channel|A covert storage channel transfers information through the setting of bits by one program and the reading of those bits by another. What distinguishes this case from that of ordinary operation is that the bits are used to convey encoded information.
CWE-52|Path Equivalence: /multiple/trailing/slash//|A software system that accepts path input in the form of multiple trailing slash (/multiple/trailing/slash//) without appropriate validation can lead to ambiguous path resolution and allow an attacker to traverse the file system to unintended locations or access arbitrary files.
CWE-520|.NET Misconfiguration: Use of Impersonation|Allowing a .NET application to run at potentially escalated levels of access to the underlying operating and file systems can be dangerous and result in various forms of attacks.
CWE-521|Weak Password Requirements|The product does not require that users should have strong passwords
CWE-522|Insufficiently Protected Credentials|This weakness occurs when the application transmits or stores authentication credentials and uses an insecure method that is susceptible to unauthorized interception and/or retrieval.
CWE-523|Unprotected Transport of Credentials|Login pages not using adequate measures to protect the user name and password while they are in transit from the client to the server.
CWE-524|Information Exposure Through Caching|The application uses a cache to maintain a pool of objects
CWE-525|Information Exposure Through Browser Caching|For each web page
CWE-526|Information Exposure Through Environmental Variables|Environmental variables may contain sensitive information about a remote server.
CWE-527|Exposure of CVS Repository to an Unauthorized Control Sphere|The product stores a CVS repository in a directory or other container that is accessible to actors outside of the intended control sphere.
CWE-528|Exposure of Core Dump File to an Unauthorized Control Sphere|The product generates a core dump file in a directory that is accessible to actors outside of the intended control sphere.
CWE-529|Exposure of Access Control List Files to an Unauthorized Control Sphere|The product stores access control list files in a directory or other container that is accessible to actors outside of the intended control sphere.
CWE-53|Path Equivalence: multipleinternalbackslash|A software system that accepts path input in the form of multiple internal backslash (multipletrailingslash) without appropriate validation can lead to ambiguous path resolution and allow an attacker to traverse the file system to unintended locations or access arbitrary files.
CWE-530|Exposure of Backup File to an Unauthorized Control Sphere|A backup file is stored in a directory that is accessible to actors outside of the intended control sphere.
CWE-531|Information Exposure Through Test Code|Accessible test applications can pose a variety of security risks. Since developers or administrators rarely consider that someone besides themselves would even know about the existence of these applications
CWE-532|Information Exposure Through Log Files|Information written to log files can be of a sensitive nature and give valuable guidance to an attacker or expose sensitive user information.
CWE-533|Information Exposure Through Server Log Files|A server.log file was found. This can give information on whatever application left the file. Usually this can give full path names and system information
CWE-534|Information Exposure Through Debug Log Files|The application does not sufficiently restrict access to a log file that is used for debugging.
CWE-535|Information Exposure Through Shell Error Message|A command shell error message indicates that there exists an unhandled exception in the web application code. In many cases
CWE-536|Information Exposure Through Servlet Runtime Error Message|A servlet error message indicates that there exists an unhandled exception in your web application code and may provide useful information to an attacker.
CWE-537|Information Exposure Through Java Runtime Error Message|In many cases
CWE-538|File and Directory Information Exposure|The product stores sensitive information in files or directories that are accessible to actors outside of the intended control sphere.
CWE-539|Information Exposure Through Persistent Cookies|Persistent cookies are cookies that are stored on the browsers hard drive. This can cause security and privacy issues depending on the information stored in the cookie and how it is accessed.
CWE-54|Path Equivalence: filedir (Trailing Backslash)|A software system that accepts path input in the form of trailing backslash (filedir) without appropriate validation can lead to ambiguous path resolution and allow an attacker to traverse the file system to unintended locations or access arbitrary files.
CWE-540|Information Exposure Through Source Code|Source code on a web server often contains sensitive information and should generally not be accessible to users.
CWE-541|Information Exposure Through Include Source Code|If an include file source is accessible
CWE-542|Information Exposure Through Cleanup Log Files|The application does not properly protect or delete a log file related to cleanup.
CWE-543|Use of Singleton Pattern Without Synchronization in a Multithreaded Context|The software uses the singleton pattern when creating a resource within a multithreaded environment.
CWE-544|Missing Standardized Error Handling Mechanism|The software does not use a standardized method for handling errors throughout the code
CWE-546|Suspicious Comment|The code contains comments that suggest the presence of bugs
CWE-547|Use of Hard-coded|Draft
CWE-548|Information Exposure Through Directory Listing|A directory listing is inappropriately exposed
CWE-549|Missing Password Field Masking|The software does not mask passwords during entry
CWE-55|Path Equivalence: /./ (Single Dot Directory)|A software system that accepts path input in the form of single dot directory exploit (/./) without appropriate validation can lead to ambiguous path resolution and allow an attacker to traverse the file system to unintended locations or access arbitrary files.
CWE-550|Information Exposure Through Server Error Message|Certain conditions
CWE-551|Incorrect Behavior Order: Authorization Before Parsing and Canonicalization|If a web server does not fully parse requested URLs before it examines them for authorization
CWE-552|Files or Directories Accessible to External Parties|Files or directories are accessible in the environment that should not be.
CWE-553|Command Shell in Externally Accessible Directory|A possible shell file exists in /cgi-bin/ or other accessible directories. This is extremely dangerous and can be used by an attacker to execute commands on the web server.
CWE-554|ASP.NET Misconfiguration: Not Using Input Validation Framework|The ASP.NET application does not use an input validation framework.
CWE-555|J2EE Misconfiguration: Plaintext Password in Configuration File|The J2EE application stores a plaintext password in a configuration file.
CWE-556|ASP.NET Misconfiguration: Use of Identity Impersonation|Configuring an ASP.NET application to run with impersonated credentials may give the application unnecessary privileges.
CWE-558|Use of getlogin() in Multithreaded Application|The application uses the getlogin() function in a multithreaded context
CWE-56|Path Equivalence: filedir* (Wildcard)|A software system that accepts path input in the form of asterisk wildcard (filedir*) without appropriate validation can lead to ambiguous path resolution and allow an attacker to traverse the file system to unintended locations or access arbitrary files.
CWE-560|Use of umask() with chmod-style Argument|The product calls umask() with an incorrect argument that is specified as if it is an argument to chmod().
CWE-561|Dead Code|The software contains dead code
CWE-562|Return of Stack Variable Address|A function returns the address of a stack variable
CWE-563|Assignment to Variable without Use|The variables value is assigned but never used
CWE-564|SQL Injection: Hibernate|Using Hibernate to execute a dynamic SQL statement built with user-controlled input can allow an attacker to modify the statements meaning or to execute arbitrary SQL commands.
CWE-565|Reliance on Cookies without Validation and Integrity Checking|The application relies on the existence or values of cookies when performing security-critical operations
CWE-566|Authorization Bypass Through User-Controlled SQL Primary Key|The software uses a database table that includes records that should not be accessible to an actor
CWE-567|Unsynchronized Access to Shared Data in a Multithreaded Context|The product does not properly synchronize shared data
CWE-568|finalize() Method Without super.finalize()|The software contains a finalize() method that does not call super.finalize().
CWE-57|Path Equivalence: fakedir/../realdir/filename|The software contains protection mechanisms to restrict access to realdir/filename
CWE-570|Expression is Always False|The software contains an expression that will always evaluate to false.
CWE-571|Expression is Always True|The software contains an expression that will always evaluate to true.
CWE-572|Call to Thread run() instead of start()|The program calls a threads run() method instead of calling start()
CWE-573|Improper Following of Specification by Caller|The software does not follow or incorrectly follows the specifications as required by the implementation language
CWE-574|EJB Bad Practices: Use of Synchronization Primitives|The program violates the Enterprise JavaBeans (EJB) specification by using thread synchronization primitives.
CWE-575|EJB Bad Practices: Use of AWT Swing|The program violates the Enterprise JavaBeans (EJB) specification by using AWT/Swing.
CWE-576|EJB Bad Practices: Use of Java I/O|The program violates the Enterprise JavaBeans (EJB) specification by using the java.io package.
CWE-577|EJB Bad Practices: Use of Sockets|The program violates the Enterprise JavaBeans (EJB) specification by using sockets.
CWE-578|EJB Bad Practices: Use of Class Loader|The program violates the Enterprise JavaBeans (EJB) specification by using the class loader.
CWE-579|J2EE Bad Practices: Non-serializable Object Stored in Session|The application stores a non-serializable object as an HttpSession attribute
CWE-58|Path Equivalence: Windows 8.3 Filename|The software contains a protection mechanism that restricts access to a long filename on a Windows operating system
CWE-580|clone() Method Without super.clone()|The software contains a clone() method that does not call super.clone() to obtain the new object.
CWE-581|Object Model Violation: Just One of Equals and Hashcode Defined|The software does not maintain equal hashcodes for equal objects.
CWE-582|Array Declared Public|Variant
CWE-583|finalize() Method Declared Public|The program violates secure coding principles for mobile code by declaring a finalize() method public.
CWE-584|Return Inside Finally Block|The code has a return statement inside a finally block
CWE-585|Empty Synchronized Block|The software contains an empty synchronized block.
CWE-586|Explicit Call to Finalize()|The software makes an explicit call to the finalize() method from outside the finalizer.
CWE-587|Assignment of a Fixed Address to a Pointer|The software sets a pointer to a specific address other than NULL or 0.
CWE-588|Attempt to Access Child of a Non-structure Pointer|Casting a non-structure type to a structure type and accessing a field can lead to memory access errors or data corruption.
CWE-589|Call to Non-ubiquitous API|The software uses an API function that does not exist on all versions of the target platform. This could cause portability problems or inconsistencies that allow denial of service or other consequences.
CWE-59|Improper Link Resolution Before File Access (Link Following)|The software attempts to access a file based on the filename
CWE-590|Free of Memory not on the Heap|The application calls free() on a pointer to memory that was not allocated using associated heap allocation functions such as malloc()
CWE-591|Sensitive Data Storage in Improperly Locked Memory|The application stores sensitive data in memory that is not locked
CWE-593|Authentication Bypass: OpenSSL CTX Object Modified after SSL Objects are Created|The software modifies the SSL context after connection creation has begun.
CWE-594|J2EE Framework: Saving Unserializable Objects to Disk|When the J2EE container attempts to write unserializable objects to disk there is no guarantee that the process will complete successfully.
CWE-595|Comparison of Object References Instead of Object Contents|The program compares object references instead of the contents of the objects themselves
CWE-596|Incorrect Semantic Object Comparison|The software does not correctly compare two objects based on their conceptual content.
CWE-597|Use of Wrong Operator in String Comparison|The product uses the wrong operator when comparing a string
CWE-598|Information Exposure Through Query Strings in GET Request|The web application uses the GET method to process requests that contain sensitive information
CWE-599|Missing Validation of OpenSSL Certificate|The software uses OpenSSL and trusts or uses a certificate without using the SSL_get_verify_result() function to ensure that the certificate satisfies all necessary security requirements.
CWE-6|J2EE Misconfiguration: Insufficient Session-ID Length|The J2EE application is configured to use an insufficient session ID length.
CWE-600|Uncaught Exception in Servlet |The Servlet does not catch all exceptions
CWE-601|URL Redirection to Untrusted Site (Open Redirect)|A web application accepts a user-controlled input that specifies a link to an external site
CWE-602|Client-Side Enforcement of Server-Side Security|The software is composed of a server that relies on the client to implement a mechanism that is intended to protect the server.
CWE-603|Use of Client-Side Authentication|A client/server product performs authentication within client code but not in server code
CWE-605|Multiple Binds to the Same Port|When multiple sockets are allowed to bind to the same port
CWE-606|Unchecked Input for Loop Condition|The product does not properly check inputs that are used for loop conditions
CWE-607|Public Static Final Field References Mutable Object|A public or protected static final field references a mutable object
CWE-608|Struts: Non-private Field in ActionForm Class|An ActionForm class contains a field that has not been declared private
CWE-609|Double-Checked Locking|The program uses double-checked locking to access a resource without the overhead of explicit synchronization
CWE-61|UNIX Symbolic Link (Symlink) Following|The software
CWE-610|Externally Controlled Reference to a Resource in Another Sphere|The product uses an externally controlled name or reference that resolves to a resource that is outside of the intended control sphere.
CWE-611|Improper Restriction of XML External Entity Reference (XXE)|The software processes an XML document that can contain XML entities with URIs that resolve to documents outside of the intended sphere of control
CWE-612|Information Exposure Through Indexing of Private Data|The product performs an indexing routine against private documents
CWE-613|Insufficient Session Expiration|According to WASC
CWE-614|Sensitive Cookie in HTTPS Session Without Secure Attribute|The Secure attribute for sensitive cookies in HTTPS sessions is not set
CWE-615|Information Exposure Through Comments|While adding general comments is very useful
CWE-616|Incomplete Identification of Uploaded File Variables (PHP)|The PHP application uses an old method for processing uploaded files by referencing the four global variables that are set for each file (e.g. $varname
CWE-617|Reachable Assertion|The product contains an assert() or similar statement that can be triggered by an attacker
CWE-618|Exposed Unsafe ActiveX Method|An ActiveX control is intended for use in a web browser
CWE-619|Dangling Database Cursor (Cursor Injection)|If a database cursor is not closed properly
CWE-62|UNIX Hard Link|The software
CWE-620|Unverified Password Change|When setting a new password for a user
CWE-621|Variable Extraction Error|The product uses external input to determine the names of variables into which information is extracted
CWE-622|Improper Validation of Function Hook Arguments|A product adds hooks to user-accessible API functions
CWE-623|Unsafe ActiveX Control Marked Safe For Scripting|An ActiveX control is intended for restricted use
CWE-624|Executable Regular Expression Error|The product uses a regular expression that either (1) contains an executable component with user-controlled inputs
CWE-625|Permissive Regular Expression|The product uses a regular expression that does not sufficiently restrict the set of allowed values.
CWE-626|Null Byte Interaction Error (Poison Null Byte)|The product does not properly handle null bytes or NUL characters when passing data between different representations or components.
CWE-627|Dynamic Variable Evaluation|In a language where the user can influence the name of a variable at runtime
CWE-628|Function Call with Incorrectly Specified Arguments|The product calls a function
CWE-636|Not Failing Securely (Failing Open)|When the product encounters an error condition or failure
CWE-637|Unnecessary Complexity in Protection Mechanism (Not Using Economy of Mechanism)|The software uses a more complex mechanism than necessary
CWE-638|Not Using Complete Mediation|The software does not perform access checks on a resource every time the resource is accessed by an entity
CWE-639|Authorization Bypass Through User-Controlled Key|The systems authorization functionality does not prevent one user from gaining access to another users data or record by modifying the key value identifying the data.
CWE-64|Windows Shortcut Following (.LNK)|The software
CWE-640|Weak Password Recovery Mechanism for Forgotten Password|The software contains a mechanism for users to recover or change their passwords without knowing the original password
CWE-641|Improper Restriction of Names for Files and Other Resources|The application constructs the name of a file or other resource using input from an upstream component
CWE-642|External Control of Critical State Data|The software stores security-critical state information about its users
CWE-643|Improper Neutralization of Data within XPath Expressions (XPath Injection)|The software uses external input to dynamically construct an XPath expression used to retrieve data from an XML database
CWE-644|Improper Neutralization of HTTP Headers for Scripting Syntax|The application does not neutralize or incorrectly neutralizes web scripting syntax in HTTP headers that can be used by web browser components that can process raw headers
CWE-645|Overly Restrictive Account Lockout Mechanism|The software contains an account lockout protection mechanism
CWE-646|Reliance on File Name or Extension of Externally-Supplied File|The software allows a file to be uploaded
CWE-647|Use of Non-Canonical URL Paths for Authorization Decisions|The software defines policy namespaces and makes authorization decisions based on the assumption that a URL is canonical. This can allow a non-canonical URL to bypass the authorization.
CWE-648|Incorrect Use of Privileged APIs|The application does not conform to the API requirements for a function call that requires extra privileges. This could allow attackers to gain privileges by causing the function to be called incorrectly.
CWE-649|Reliance on Obfuscation or Encryption of Security-Relevant Inputs without Integrity Checking|The software uses obfuscation or encryption of inputs that should not be mutable by an external actor
