cwe|name|description
CWE-294|Authentication Bypass by Capture-replay|A capture-replay flaw exists when the design of the software makes it possible for a malicious user to sniff network traffic and bypass authentication by replaying it to the server in question to the same effect as the original message (or with minor changes).
CWE-295|Improper Certificate Validation|The software does not validate
CWE-296|Improper Following of a Certificates Chain of Trust|The software does not follow
CWE-297|Improper Validation of Certificate with Host Mismatch|The software communicates with a host that provides a certificate
CWE-298|Improper Validation of Certificate Expiration|A certificate expiration is not validated or is incorrectly validated
CWE-299|Improper Check for Certificate Revocation|The software does not check or incorrectly checks the revocation status of a certificate
CWE-30|Path Traversal: dir..filename|The software uses external input to construct a pathname that should be within a restricted directory
CWE-300|Channel Accessible by Non-Endpoint (Man-in-the-Middle)|The product does not adequately verify the identity of actors at both ends of a communication channel
CWE-301|Reflection Attack in an Authentication Protocol|Simple authentication protocols are subject to reflection attacks if a malicious user can use the target machine to impersonate a trusted user.
CWE-302|Authentication Bypass by Assumed-Immutable Data|The authentication scheme or implementation uses key data elements that are assumed to be immutable
CWE-303|Incorrect Implementation of Authentication Algorithm|The requirements for the software dictate the use of an established authentication algorithm
CWE-304|Missing Critical Step in Authentication|The software implements an authentication technique
CWE-305|Authentication Bypass by Primary Weakness|The authentication algorithm is sound
CWE-306|Missing Authentication for Critical Function|The software does not perform any authentication for functionality that requires a provable user identity or consumes a significant amount of resources.
CWE-307|Improper Restriction of Excessive Authentication Attempts|The software does not implement sufficient measures to prevent multiple failed authentication attempts within in a short time frame
CWE-308|Use of Single-factor Authentication|The use of single-factor authentication can lead to unnecessary risk of compromise when compared with the benefits of a dual-factor authentication scheme.
CWE-309|Use of Password System for Primary Authentication|The use of password systems as the primary means of authentication may be subject to several flaws or shortcomings
CWE-31|Path Traversal: dir....filename|The software uses external input to construct a pathname that should be within a restricted directory
CWE-311|Missing Encryption of Sensitive Data|The software does not encrypt sensitive or critical information before storage or transmission.
CWE-312|Cleartext Storage of Sensitive Information|The application stores sensitive information in cleartext within a resource that might be accessible to another control sphere.
CWE-313|Cleartext Storage in a File or on Disk|The application stores sensitive information in cleartext in a file
CWE-314|Cleartext Storage in the Registry|The application stores sensitive information in cleartext in the registry.
CWE-315|Cleartext Storage of Sensitive Information in a Cookie|The application stores sensitive information in cleartext in a cookie.
CWE-316|Cleartext Storage of Sensitive Information in Memory|The application stores sensitive information in cleartext in memory.
CWE-317|Cleartext Storage of Sensitive Information in GUI|The application stores sensitive information in cleartext within the GUI.
CWE-318|Cleartext Storage of Sensitive Information in Executable|The application stores sensitive information in cleartext in an executable.
CWE-319|Cleartext Transmission of Sensitive Information|The software transmits sensitive or security-critical data in cleartext in a communication channel that can be sniffed by unauthorized actors.
CWE-32|Path Traversal: ... (Triple Dot)|The software uses external input to construct a pathname that should be within a restricted directory
CWE-321|Use of Hard-coded Cryptographic Key|The use of a hard-coded cryptographic key significantly increases the possibility that encrypted data may be recovered.
CWE-322|Key Exchange without Entity Authentication|The software performs a key exchange with an actor without verifying the identity of that actor.
CWE-323|Reusing a Nonce|Incomplete
CWE-324|Use of a Key Past its Expiration Date|The product uses a cryptographic key or password past its expiration date
CWE-325|Missing Required Cryptographic Step|The software does not implement a required step in a cryptographic algorithm
CWE-326|Inadequate Encryption Strength|The software stores or transmits sensitive data using an encryption scheme that is theoretically sound
CWE-327|Use of a Broken or Risky Cryptographic Algorithm|The use of a broken or risky cryptographic algorithm is an unnecessary risk that may result in the exposure of sensitive information.
CWE-328|Reversible One-Way Hash|The product uses a hashing algorithm that produces a hash value that can be used to determine the original input
CWE-329|Not Using a Random IV with CBC Mode|Not using a random initialization Vector (IV) with Cipher Block Chaining (CBC) Mode causes algorithms to be susceptible to dictionary attacks.
CWE-33|Path Traversal: .... (Multiple Dot)|The software uses external input to construct a pathname that should be within a restricted directory
CWE-330|Use of Insufficiently Random Values|The software may use insufficiently random numbers or values in a security context that depends on unpredictable numbers.
CWE-331|Insufficient Entropy|The software uses an algorithm or scheme that produces insufficient entropy
CWE-332|Insufficient Entropy in PRNG|The lack of entropy available for
CWE-333|Improper Handling of Insufficient Entropy in TRNG|True random number generators (TRNG) generally have a limited source of entropy and therefore can fail or block.
CWE-334|Small Space of Random Values|The number of possible random values is smaller than needed by the product
CWE-335|Incorrect Usage of Seeds in Pseudo-Random Number Generator (PRNG)|The software uses a Pseudo-Random Number Generator (PRNG) that does not correctly manage seeds.
CWE-336|Same Seed in Pseudo-Random Number Generator (PRNG)|A Pseudo-Random Number Generator (PRNG) uses the same seed each time the product is initialized.
CWE-337|Predictable Seed in Pseudo-Random Number Generator (PRNG)|A Pseudo-Random Number Generator (PRNG) is initialized from a predictable seed
CWE-338|Use of Cryptographically Weak Pseudo-Random Number Generator (PRNG)|The product uses a Pseudo-Random Number Generator (PRNG) in a security context
CWE-339|Small Seed Space in PRNG|A PRNG uses a relatively small space of seeds.
CWE-34|Path Traversal: ....//|The software uses external input to construct a pathname that should be within a restricted directory
CWE-340|Predictability Problems|Weaknesses in this category are related to schemes that generate numbers or identifiers that are more predictable than required by the application.
CWE-341|Predictable from Observable State|A number or object is predictable based on observations that the attacker can make about the state of the system or network
CWE-342|Predictable Exact Value from Previous Values|An exact value or random number can be precisely predicted by observing previous values.
CWE-343|Predictable Value Range from Previous Values|The softwares random number generator produces a series of values which
CWE-344|Use of Invariant Value in Dynamically Changing Context|The product uses a constant value
CWE-345|Insufficient Verification of Data Authenticity|The software does not sufficiently verify the origin or authenticity of data
CWE-346|Origin Validation Error|The software does not properly verify that the source of data or communication is valid.
CWE-347|Improper Verification of Cryptographic Signature|The software does not verify
CWE-348|Use of Less Trusted Source|The software has two different sources of the same data or information
CWE-349|Acceptance of Extraneous Untrusted Data With Trusted Data|The software
CWE-35|Path Traversal: .../...//|The software uses external input to construct a pathname that should be within a restricted directory
CWE-350|Reliance on Reverse DNS Resolution for a Security-Critical Action|The software performs reverse DNS resolution on an IP address to obtain the hostname and make a security decision
CWE-351|Insufficient Type Distinction|The software does not properly distinguish between different types of elements in a way that leads to insecure behavior.
CWE-352|Cross-Site Request Forgery (CSRF)|The web application does not
CWE-353|Missing Support for Integrity Check|The software uses a transmission protocol that does not include a mechanism for verifying the integrity of the data during transmission
CWE-354|Improper Validation of Integrity Check Value|The software does not validate or incorrectly validates the integrity check values or checksums of a message. This may prevent it from detecting if the data has been modified or corrupted in transmission.
CWE-356|Product UI does not Warn User of Unsafe Actions|The softwares user interface does not warn the user before undertaking an unsafe action on behalf of that user. This makes it easier for attackers to trick users into inflicting damage to their system.
CWE-357|Insufficient UI Warning of Dangerous Operations|The user interface provides a warning to a user regarding dangerous or sensitive operations
CWE-358|Improperly Implemented Security Check for Standard|The software does not implement or incorrectly implements one or more security-relevant checks as specified by the design of a standardized algorithm
CWE-359|Exposure of Private Information (Privacy Violation)|The software does not properly prevent private data (such as credit card numbers) from being accessed by actors who either (1) are not explicitly authorized to access the data or (2) do not have the implicit consent of the people to which the data is related.
CWE-36|Absolute Path Traversal|The software uses external input to construct a pathname that should be within a restricted directory
CWE-360|Trust of System Event Data|Security based on event locations are insecure and can be spoofed.
CWE-362|Concurrent Execution using Shared Resource with Improper Synchronization (Race Condition)|The program contains a code sequence that can run concurrently with other code
CWE-363|Race Condition Enabling Link Following|The software checks the status of a file or directory before accessing it
CWE-364|Signal Handler Race Condition|The software uses a signal handler that introduces a race condition.
CWE-365|Race Condition in Switch|The code contains a switch statement in which the switched variable can be modified while the switch is still executing
CWE-366|Race Condition within a Thread|If two threads of execution use a resource simultaneously
CWE-367|Time-of-check Time-of-use (TOCTOU) Race Condition|The software checks the state of a resource before using that resource
CWE-368|Context Switching Race Condition|A product performs a series of non-atomic actions to switch between contexts that cross privilege or other security boundaries
CWE-369|Divide By Zero|The product divides a value by zero.
CWE-37|Path Traversal: /absolute/pathname/here|A software system that accepts input in the form of a slash absolute path (/absolute/pathname/here) without appropriate validation can allow an attacker to traverse the file system to unintended locations or access arbitrary files.
CWE-370|Missing Check for Certificate Revocation after Initial Check|The software does not check the revocation status of a certificate after its initial revocation check
CWE-372|Incomplete Internal State Distinction|The software does not properly determine which state it is in
CWE-374|Passing Mutable Objects to an Untrusted Method|The program sends non-cloned mutable data as an argument to a method or function.
CWE-375|Returning a Mutable Object to an Untrusted Caller|Sending non-cloned mutable data as a return value may result in that data being altered or deleted by the calling function.
CWE-377|Insecure Temporary File|Creating and using insecure temporary files can leave application and system data vulnerable to attack.
CWE-378|Creation of Temporary File With Insecure Permissions|Opening temporary files without appropriate measures or controls can leave the file
CWE-379|Creation of Temporary File in Directory with Incorrect Permissions|The software creates a temporary file in a directory whose permissions allow unintended actors to determine the files existence or otherwise access that file.
CWE-38|Path Traversal: absolutepathnamehere|A software system that accepts input in the form of a backslash absolute path (absolutepathnamehere) without appropriate validation can allow an attacker to traverse the file system to unintended locations or access arbitrary files.
CWE-382|J2EE Bad Practices: Use of System.exit()|A J2EE application uses System.exit()
CWE-383|J2EE Bad Practices: Direct Use of Threads|Thread management in a Web application is forbidden in some circumstances and is always highly error prone.
CWE-384|Session Fixation|Authenticating a user
CWE-385|Covert Timing Channel|Covert timing channels convey information by modulating some aspect of system behavior over time
CWE-386|Symbolic Name not Mapping to Correct Object|A constant symbolic reference to an object is used
CWE-39|Path Traversal: C:dirname|An attacker can inject a drive letter or Windows volume letter (C:dirname) into a software system to potentially redirect access to an unintended location or arbitrary file.
CWE-390|Detection of Error Condition Without Action|The software detects a specific error
CWE-391|Unchecked Error Condition|Ignoring exceptions and other error conditions may allow an attacker to induce unexpected behavior unnoticed.
CWE-392|Missing Report of Error Condition|The software encounters an error but does not provide a status code or return value to indicate that an error has occurred.
CWE-393|Return of Wrong Status Code|A function or operation returns an incorrect return value or status code that does not indicate an error
CWE-394|Unexpected Status Code or Return Value|The software does not properly check when a function or operation returns a value that is legitimate for the function
CWE-395|Use of NullPointerException Catch to Detect NULL Pointer Dereference|Catching NullPointerException should not be used as an alternative to programmatic checks to prevent dereferencing a null pointer.
CWE-396|Declaration of Catch for Generic Exception|Catching overly broad exceptions promotes complex error handling code that is more likely to contain security vulnerabilities.
CWE-397|Declaration of Throws for Generic Exception|Throwing overly broad exceptions promotes complex error handling code that is more likely to contain security vulnerabilities.
CWE-40|Path Traversal: UNCsharename (Windows UNC Share)|An attacker can inject a Windows UNC share (UNCsharename) into a software system to potentially redirect access to an unintended location or arbitrary file.
CWE-400|Uncontrolled Resource Consumption (Resource Exhaustion)|The software does not properly restrict the size or amount of resources that are requested or influenced by an actor
CWE-401|Improper Release of Memory Before Removing Last Reference (Memory Leak)|The software does not sufficiently track and release allocated memory after it has been used
CWE-402|Transmission of Private Resources into a New Sphere (Resource Leak)|The software makes resources available to untrusted parties when those resources are only intended to be accessed by the software.
CWE-403|Exposure of File Descriptor to Unintended Control Sphere (File Descriptor Leak)|A process does not close sensitive file descriptors before invoking a child process
CWE-404|Improper Resource Shutdown or Release|The program does not release or incorrectly releases a resource before it is made available for re-use.
CWE-405|Asymmetric Resource Consumption (Amplification)|Software that does not appropriately monitor or control resource consumption can lead to adverse system performance.
CWE-406|Insufficient Control of Network Message Volume (Network Amplification)|The software does not sufficiently monitor or control transmitted network traffic volume
CWE-407|Algorithmic Complexity|An algorithm in a product has an inefficient worst-case computational complexity that may be detrimental to system performance and can be triggered by an attacker
CWE-408|Incorrect Behavior Order: Early Amplification|The software allows an entity to perform a legitimate but expensive operation before authentication or authorization has taken place.
CWE-409|Improper Handling of Highly Compressed Data (Data Amplification)|The software does not handle or incorrectly handles a compressed input with a very high compression ratio that produces a large output.
CWE-41|Improper Resolution of Path Equivalence|The system or application is vulnerable to file system contents disclosure through path equivalence. Path equivalence involves the use of special characters in file and directory names. The associated manipulations are intended to generate multiple names for the same object.
CWE-410|Insufficient Resource Pool|The softwares resource pool is not large enough to handle peak demand
CWE-412|Unrestricted Externally Accessible Lock|The software properly checks for the existence of a lock
CWE-413|Improper Resource Locking|The software does not lock or does not correctly lock a resource when the software must have exclusive access to the resource.
CWE-414|Missing Lock Check|A product does not check to see if a lock is present before performing sensitive operations on a resource.
CWE-415|Double Free|The product calls free() twice on the same memory address
CWE-416|Use After Free|Referencing memory after it has been freed can cause a program to crash
CWE-419|Unprotected Primary Channel|The software uses a primary channel for administration or restricted functionality
CWE-42|Path Equivalence: filename. (Trailing Dot)|A software system that accepts path input in the form of trailing dot (filedir.) without appropriate validation can lead to ambiguous path resolution and allow an attacker to traverse the file system to unintended locations or access arbitrary files.
CWE-420|Unprotected Alternate Channel|The software protects a primary channel
CWE-421|Race Condition During Access to Alternate Channel|The product opens an alternate channel to communicate with an authorized user
CWE-422|Unprotected Windows Messaging Channel (Shatter)|The software does not properly verify the source of a message in the Windows Messaging System while running at elevated privileges
CWE-424|Improper Protection of Alternate Path|The product does not sufficiently protect all possible paths that a user can take to access restricted functionality or resources.
CWE-425|Direct Request (Forced Browsing)|The web application does not adequately enforce appropriate authorization on all restricted URLs
CWE-426|Untrusted Search Path|The application searches for critical resources using an externally-supplied search path that can point to resources that are not under the applications direct control.
CWE-427|Uncontrolled Search Path Element|The product uses a fixed or controlled search path to find resources
CWE-428|Unquoted Search Path or Element|The product uses a search path that contains an unquoted element
CWE-43|Path Equivalence: filename.... (Multiple Trailing Dot)|A software system that accepts path input in the form of multiple trailing dot (filedir....) without appropriate validation can lead to ambiguous path resolution and allow an attacker to traverse the file system to unintended locations or access arbitrary files.
CWE-430|Deployment of Wrong Handler|The wrong handler is assigned to process an object.
CWE-431|Missing Handler|A handler is not available or implemented.
CWE-432|Dangerous Signal Handler not Disabled During Sensitive Operations|The application uses a signal handler that shares state with other signal handlers
CWE-433|Unparsed Raw Web Content Delivery|The software stores raw content or supporting code under the web document root with an extension that is not specifically handled by the server.
CWE-434|Unrestricted Upload of File with Dangerous Type|The software allows the attacker to upload or transfer files of dangerous types that can be automatically processed within the products environment.
CWE-435|Improper Interaction Between Multiple Entities|An interaction error occurs when two entities work correctly when running independently
CWE-436|Interpretation Conflict|Product A handles inputs or steps differently than Product B
CWE-437|Incomplete Model of Endpoint Features|A product acts as an intermediary or monitor between two or more endpoints
CWE-439|Behavioral Change in New Version or Environment|As behavior or functionality changes with a new version of A
CWE-44|Path Equivalence: file.name (Internal Dot)|A software system that accepts path input in the form of internal dot (file.ordir) without appropriate validation can lead to ambiguous path resolution and allow an attacker to traverse the file system to unintended locations or access arbitrary files.
CWE-440|Expected Behavior Violation|A feature
CWE-441|Unintended Proxy or Intermediary (Confused Deputy)|The software receives a request
CWE-444|Inconsistent Interpretation of HTTP Requests (HTTP Request Smuggling)|When malformed or abnormal HTTP requests are interpreted by one or more entities in the data flow between the user and the web server
CWE-446|UI Discrepancy for Security Feature|The user interface does not correctly enable or configure a security feature
CWE-447|Unimplemented or Unsupported Feature in UI|A UI function for a security feature appears to be supported and gives feedback to the user that suggests that it is supported
CWE-448|Obsolete Feature in UI|A UI function is obsolete and the product does not warn the user.
CWE-449|The UI Performs the Wrong Action|The UI performs the wrong action with respect to the users request.
CWE-45|Path Equivalence: file...name (Multiple Internal Dot)|A software system that accepts path input in the form of multiple internal dot (file...dir) without appropriate validation can lead to ambiguous path resolution and allow an attacker to traverse the file system to unintended locations or access arbitrary files.
CWE-450|Multiple Interpretations of UI Input|The UI has multiple interpretations of user input but does not prompt the user when it selects the less secure interpretation.
CWE-451|User Interface (UI) Misrepresentation of Critical Information|The user interface (UI) does not properly represent critical information to the user
CWE-453|Insecure Default Variable Initialization|The software
CWE-454|External Initialization of Trusted Variables or Data Stores|The software initializes critical internal variables or data stores using inputs that can be modified by untrusted actors.
CWE-455|Non-exit on Failed Initialization|The software does not exit or otherwise modify its operation when security-relevant errors occur during initialization
CWE-456|Missing Initialization of a Variable|The software does not initialize critical variables
CWE-457|Use of Uninitialized Variable|The code uses a variable that has not been initialized
CWE-459|Incomplete Cleanup|The software does not properly clean up and remove temporary or supporting resources after they have been used.
CWE-46|Path Equivalence: filename  (Trailing Space)|A software system that accepts path input in the form of trailing space (filedir ) without appropriate validation can lead to ambiguous path resolution and allow an attacker to traverse the file system to unintended locations or access arbitrary files.
CWE-460|Improper Cleanup on Thrown Exception|The product does not clean up its state or incorrectly cleans up its state when an exception is thrown
CWE-462|Duplicate Key in Associative List (Alist)|Duplicate keys in associative lists can lead to non-unique keys being mistaken for an error.
CWE-463|Deletion of Data Structure Sentinel|The accidental deletion of a data-structure sentinel can cause serious programming logic problems.
CWE-464|Addition of Data Structure Sentinel|The accidental addition of a data-structure sentinel can cause serious programming logic problems.
CWE-466|Return of Pointer Value Outside of Expected Range|A function can return a pointer to memory that is outside of the buffer that the pointer is expected to reference.
CWE-467|Use of sizeof() on a Pointer Type|The code calls sizeof() on a malloced pointer type
CWE-468|Incorrect Pointer Scaling|In C and C++
CWE-469|Use of Pointer Subtraction to Determine Size|The application subtracts one pointer from another in order to determine size
CWE-47|Path Equivalence:  filename (Leading Space)|A software system that accepts path input in the form of leading space ( filedir) without appropriate validation can lead to ambiguous path resolution and allow an attacker to traverse the file system to unintended locations or access arbitrary files.
CWE-470|Use of Externally-Controlled Input to Select Classes or Code (Unsafe Reflection)|The application uses external input with reflection to select which classes or code to use
CWE-471|Modification of Assumed-Immutable Data (MAID)|The software does not properly protect an assumed-immutable element from being modified by an attacker.
CWE-472|External Control of Assumed-Immutable Web Parameter|The web application does not sufficiently verify inputs that are assumed to be immutable but are actually externally controllable
