cwe|name|description
CWE-65|Windows Hard Link|The software
CWE-650|Trusting HTTP Permission Methods on the Server Side|The server contains a protection mechanism that assumes that any URI that is accessed using HTTP GET will not cause a state change to the associated resource. This might allow attackers to bypass intended access restrictions and conduct resource modification and deletion attacks
CWE-651|Information Exposure Through WSDL File|The Web services architecture may require exposing a Web Service Definition Language (WSDL) file that contains information on the publicly accessible services and how callers of these services should interact with them (e.g. what parameters they expect and what types they return).
CWE-652|Improper Neutralization of Data within XQuery Expressions (XQuery Injection)|The software uses external input to dynamically construct an XQuery expression used to retrieve data from an XML database
CWE-653|Insufficient Compartmentalization|The product does not sufficiently compartmentalize functionality or processes that require different privilege levels
CWE-654|Reliance on a Single Factor in a Security Decision|A protection mechanism relies exclusively
CWE-655|Insufficient Psychological Acceptability|The software has a protection mechanism that is too difficult or inconvenient to use
CWE-656|Reliance on Security Through Obscurity|The software uses a protection mechanism whose strength depends heavily on its obscurity
CWE-657|Violation of Secure Design Principles|The product violates well-established principles for secure design.
CWE-66|Improper Handling of File Names that Identify Virtual Resources|The product does not handle or incorrectly handles a file name that identifies a virtual resource that is not directly specified within the directory that is associated with the file name
CWE-662|Improper Synchronization|The software attempts to use a shared resource in an exclusive manner
CWE-663|Use of a Non-reentrant Function in a Concurrent Context|The software calls a non-reentrant function in a concurrent context in which a competing code sequence (e.g. thread or signal handler) may have an opportunity to call the same function or otherwise influence its state.
CWE-664|Improper Control of a Resource Through its Lifetime|The software does not maintain or incorrectly maintains control over a resource throughout its lifetime of creation
CWE-665|Improper Initialization|The software does not initialize or incorrectly initializes a resource
CWE-666|Operation on Resource in Wrong Phase of Lifetime|The software performs an operation on a resource at the wrong phase of the resources lifecycle
CWE-667|Improper Locking|The software does not properly acquire a lock on a resource
CWE-668|Exposure of Resource to Wrong Sphere|The product exposes a resource to the wrong control sphere
CWE-669|Incorrect Resource Transfer Between Spheres|The product does not properly transfer a resource/behavior to another sphere
CWE-67|Improper Handling of Windows Device Names|The software constructs pathnames from user input
CWE-670|Always-Incorrect Control Flow Implementation|The code contains a control flow path that does not reflect the algorithm that the path is intended to implement
CWE-671|Lack of Administrator Control over Security|The product uses security features in a way that prevents the products administrator from tailoring security settings to reflect the environment in which the product is being used. This introduces resultant weaknesses or prevents it from operating at a level of security that is desired by the administrator.
CWE-672|Operation on a Resource after Expiration or Release|The software uses
CWE-673|External Influence of Sphere Definition|The product does not prevent the definition of control spheres from external actors.
CWE-674|Uncontrolled Recursion|The product does not properly control the amount of recursion that takes place
CWE-675|Duplicate Operations on Resource|The product performs the same operation on a resource two or more times
CWE-676|Use of Potentially Dangerous Function|The program invokes a potentially dangerous function that could introduce a vulnerability if it is used incorrectly
CWE-680|Integer Overflow to Buffer Overflow|The product performs a calculation to determine how much memory to allocate
CWE-681|Incorrect Conversion between Numeric Types|When converting from one data type to another
CWE-682|Incorrect Calculation|The software performs a calculation that generates incorrect or unintended results that are later used in security-critical decisions or resource management.
CWE-683|Function Call With Incorrect Order of Arguments|The software calls a function
CWE-684|Incorrect Provision of Specified Functionality|The code does not function according to its published specifications
CWE-685|Function Call With Incorrect Number of Arguments|The software calls a function
CWE-686|Function Call With Incorrect Argument Type|The software calls a function
CWE-687|Function Call With Incorrectly Specified Argument Value|The software calls a function
CWE-688|Function Call With Incorrect Variable or Reference as Argument|The software calls a function
CWE-689|Permission Race Condition During Resource Copy|The product
CWE-69|Improper Handling of Windows ::DATA Alternate Data Stream|The software does not properly prevent access to
CWE-690|Unchecked Return Value to NULL Pointer Dereference|The product does not check for an error after calling a function that can return with a NULL pointer if the function fails
CWE-691|Insufficient Control Flow Management|The code does not sufficiently manage its control flow during execution
CWE-692|Incomplete Blacklist to Cross-Site Scripting|The product uses a blacklist-based protection mechanism to defend against XSS attacks
CWE-693|Protection Mechanism Failure|The product does not use or incorrectly uses a protection mechanism that provides sufficient defense against directed attacks against the product.
CWE-694|Use of Multiple Resources with Duplicate Identifier|The software uses multiple resources that can have the same identifier
CWE-695|Use of Low-Level Functionality|The software uses low-level functionality that is explicitly prohibited by the framework or specification under which the software is supposed to operate.
CWE-696|Incorrect Behavior Order|The software performs multiple related behaviors
CWE-697|Insufficient Comparison|The software compares two entities in a security-relevant context
CWE-698|Execution After Redirect (EAR)|The web application sends a redirect to another location
CWE-7|J2EE Misconfiguration: Missing Custom Error Page|The default error page of a web application should not display sensitive information about the software system.
CWE-703|Improper Check or Handling of Exceptional Conditions|The software does not properly anticipate or handle exceptional conditions that rarely occur during normal operation of the software.
CWE-704|Incorrect Type Conversion or Cast|The software does not correctly convert an object
CWE-705|Incorrect Control Flow Scoping|The software does not properly return control flow to the proper location after it has completed a task or detected an unusual condition.
CWE-706|Use of Incorrectly-Resolved Name or Reference|The software uses a name or reference to access a resource
CWE-707|Improper Enforcement of Message or Data Structure|The software does not enforce or incorrectly enforces that structured messages or data are well-formed before being read from an upstream component or sent to a downstream component.
CWE-708|Incorrect Ownership Assignment|The software assigns an owner to a resource
CWE-710|Improper Adherence to Coding Standards|The software does not follow certain coding rules for development
CWE-72|Improper Handling of Apple HFS+ Alternate Data Stream Path|The software does not properly handle special paths that may identify the data or resource fork of a file on the HFS+ file system.
CWE-73|External Control of File Name or Path|The software allows user input to control or influence paths or file names that are used in filesystem operations.
CWE-732|Incorrect Permission Assignment for Critical Resource|The software specifies permissions for a security-critical resource in a way that allows that resource to be read or modified by unintended actors.
CWE-733|Compiler Optimization Removal or Modification of Security-critical Code|The developer builds a security-critical protection mechanism into the software but the compiler optimizes the program such that the mechanism is removed or modified.
CWE-74|Improper Neutralization of Special Elements in Output Used by a Downstream Component (Injection)|The software constructs all or part of a command
CWE-749|Exposed Dangerous Method or Function|The software provides an Applications Programming Interface (API) or similar interface for interaction with external actors
CWE-75|Failure to Sanitize Special Elements into a Different Plane (Special Element Injection)|The software does not adequately filter user-controlled input for special elements with control implications.
CWE-754|Improper Check for Unusual or Exceptional Conditions|The software does not check or improperly checks for unusual or exceptional conditions that are not expected to occur frequently during day to day operation of the software.
CWE-755|Improper Handling of Exceptional Conditions|The software does not handle or incorrectly handles an exceptional condition.
CWE-756|Missing Custom Error Page|The software does not return custom error pages to the user
CWE-757|Selection of Less-Secure Algorithm During Negotiation (Algorithm Downgrade)|A protocol or its implementation supports interaction between multiple actors and allows those actors to negotiate which algorithm should be used as a protection mechanism such as encryption or authentication
CWE-758|Reliance on Undefined|Class
CWE-759|Use of a One-Way Hash without a Salt|The software uses a one-way cryptographic hash against an input that should not be reversible
CWE-76|Improper Neutralization of Equivalent Special Elements|The software properly neutralizes certain special elements
CWE-760|Use of a One-Way Hash with a Predictable Salt|The software uses a one-way cryptographic hash against an input that should not be reversible
CWE-761|Free of Pointer not at Start of Buffer|The application calls free() on a pointer to a memory resource that was allocated on the heap
CWE-762|Mismatched Memory Management Routines|The application attempts to return a memory resource to the system
CWE-763|Release of Invalid Pointer or Reference|The application attempts to return a memory resource to the system
CWE-764|Multiple Locks of a Critical Resource|The software locks a critical resource more times than intended
CWE-765|Multiple Unlocks of a Critical Resource|The software unlocks a critical resource more times than intended
CWE-766|Critical Variable Declared Public|The software declares a critical variable or field to be public when intended security policy requires it to be private.
CWE-767|Access to Critical Private Variable via Public Method|The software defines a public method that reads or modifies a private variable.
CWE-768|Incorrect Short Circuit Evaluation|The software contains a conditional statement with multiple logical expressions in which one of the non-leading expressions may produce side effects. This may lead to an unexpected state in the program after the execution of the conditional
CWE-769|Uncontrolled File Descriptor Consumption|The software does not properly limit the number of open file descriptors that it uses.
CWE-77|Improper Neutralization of Special Elements used in a Command (Command Injection)|The software constructs all or part of a command using externally-influenced input from an upstream component
CWE-770|Allocation of Resources Without Limits or Throttling|The software allocates a reusable resource or group of resources on behalf of an actor without imposing any restrictions on how many resources can be allocated
CWE-771|Missing Reference to Active Allocated Resource|The software does not properly maintain a reference to a resource that has been allocated
CWE-772|Missing Release of Resource after Effective Lifetime|The software does not release a resource after its effective lifetime has ended
CWE-773|Missing Reference to Active File Descriptor or Handle|The software does not properly maintain references to a file descriptor or handle
CWE-774|Allocation of File Descriptors or Handles Without Limits or Throttling|The software allocates file descriptors or handles on behalf of an actor without imposing any restrictions on how many descriptors can be allocated
CWE-775|Missing Release of File Descriptor or Handle after Effective Lifetime|The software does not release a file descriptor or handle after its effective lifetime has ended
CWE-776|Improper Restriction of Recursive Entity References in DTDs (XML Entity Expansion)|The software uses XML documents and allows their structure to be defined with a Document Type Definition (DTD)
CWE-777|Regular Expression without Anchors|The software uses a regular expression to perform neutralization
CWE-778|Insufficient Logging|When a security-critical event occurs
CWE-779|Logging of Excessive Data|The software logs too much information
CWE-78|Improper Neutralization of Special Elements used in an OS Command (OS Command Injection)|The software constructs all or part of an OS command using externally-influenced input from an upstream component
CWE-780|Use of RSA Algorithm without OAEP|The software uses the RSA algorithm but does not incorporate Optimal Asymmetric Encryption Padding (OAEP)
CWE-781|Improper Address Validation in IOCTL with METHOD_NEITHER I/O Control Code|The software defines an IOCTL that uses METHOD_NEITHER for I/O
CWE-782|Exposed IOCTL with Insufficient Access Control|The software implements an IOCTL with functionality that should be restricted
CWE-783|Operator Precedence Logic Error|The program uses an expression in which operator precedence causes incorrect logic to be used.
CWE-784|Reliance on Cookies without Validation and Integrity Checking in a Security Decision|The application uses a protection mechanism that relies on the existence or values of a cookie
CWE-785|Use of Path Manipulation Function without Maximum-sized Buffer|The software invokes a function for normalizing paths or file names
CWE-786|Access of Memory Location Before Start of Buffer|The software reads or writes to a buffer using an index or pointer that references a memory location prior to the beginning of the buffer.
CWE-787|Out-of-bounds Write|The software writes data past the end
CWE-788|Access of Memory Location After End of Buffer|The software reads or writes to a buffer using an index or pointer that references a memory location after the end of the buffer.
CWE-789|Uncontrolled Memory Allocation|The product allocates memory based on an untrusted size value
CWE-79|Improper Neutralization of Input During Web Page Generation (Cross-site Scripting)|The software does not neutralize or incorrectly neutralizes user-controllable input before it is placed in output that is used as a web page that is served to other users.
CWE-790|Improper Filtering of Special Elements|The software receives data from an upstream component
CWE-791|Incomplete Filtering of Special Elements|The software receives data from an upstream component
CWE-792|Incomplete Filtering of One or More Instances of Special Elements|The software receives data from an upstream component
CWE-793|Only Filtering One Instance of a Special Element|The software receives data from an upstream component
CWE-794|Incomplete Filtering of Multiple Instances of Special Elements|The software receives data from an upstream component
CWE-795|Only Filtering Special Elements at a Specified Location|The software receives data from an upstream component
CWE-796|Only Filtering Special Elements Relative to a Marker|The software receives data from an upstream component
CWE-797|Only Filtering Special Elements at an Absolute Position|The software receives data from an upstream component
CWE-798|Use of Hard-coded Credentials|The software contains hard-coded credentials
CWE-799|Improper Control of Interaction Frequency|The software does not properly limit the number or frequency of interactions that it has with an actor
CWE-8|J2EE Misconfiguration: Entity Bean Declared Remote|When an application exposes a remote interface for an entity bean
CWE-80|Improper Neutralization of Script-Related HTML Tags in a Web Page (Basic XSS)|The software receives input from an upstream component
CWE-804|Guessable CAPTCHA|The software uses a CAPTCHA challenge
CWE-805|Buffer Access with Incorrect Length Value|The software uses a sequential operation to read or write a buffer
CWE-806|Buffer Access Using Size of Source Buffer|The software uses the size of a source buffer when reading from or writing to a destination buffer
CWE-807|Reliance on Untrusted Inputs in a Security Decision|The application uses a protection mechanism that relies on the existence or values of an input
CWE-81|Improper Neutralization of Script in an Error Message Web Page|The software receives input from an upstream component
CWE-82|Improper Neutralization of Script in Attributes of IMG Tags in a Web Page|The web application does not neutralize or incorrectly neutralizes scripting elements within attributes of HTML IMG tags
CWE-820|Missing Synchronization|The software utilizes a shared resource in a concurrent manner but does not attempt to synchronize access to the resource.
CWE-821|Incorrect Synchronization|The software utilizes a shared resource in a concurrent manner but it does not correctly synchronize access to the resource.
CWE-822|Untrusted Pointer Dereference|The program obtains a value from an untrusted source
CWE-823|Use of Out-of-range Pointer Offset|The program performs pointer arithmetic on a valid pointer
CWE-824|Access of Uninitialized Pointer|The program accesses or uses a pointer that has not been initialized.
CWE-825|Expired Pointer Dereference|The program dereferences a pointer that contains a location for memory that was previously valid
CWE-826|Premature Release of Resource During Expected Lifetime|The program releases a resource that is still intended to be used by the program itself or another actor.
CWE-827|Improper Control of Document Type Definition|The software does not restrict a reference to a Document Type Definition (DTD) to the intended control sphere. This might allow attackers to reference arbitrary DTDs
CWE-828|Signal Handler with Functionality that is not Asynchronous-Safe|The software defines a signal handler that contains code sequences that are not asynchronous-safe
CWE-829|Inclusion of Functionality from Untrusted Control Sphere|The software imports
CWE-83|Improper Neutralization of Script in Attributes in a Web Page|The software does not neutralize or incorrectly neutralizes javascript: or other URIs from dangerous attributes within tags
CWE-830|Inclusion of Web Functionality from an Untrusted Source|The software includes web functionality (such as a web widget) from another domain
CWE-831|Signal Handler Function Associated with Multiple Signals|The software defines a function that is used as a handler for more than one signal.
CWE-832|Unlock of a Resource that is not Locked|The software attempts to unlock a resource that is not locked.
CWE-833|Deadlock|The software contains multiple threads or executable segments that are waiting for each other to release a necessary lock
CWE-834|Excessive Iteration|The software performs an iteration or loop without sufficiently limiting the number of times that the loop is executed.
CWE-835|Loop with Unreachable Exit Condition (Infinite Loop)|The program contains an iteration or loop with an exit condition that cannot be reached
CWE-836|Use of Password Hash Instead of Password for Authentication|The software records password hashes in a data store
CWE-837|Improper Enforcement of a Single|Incomplete
CWE-838|Inappropriate Encoding for Output Context|The software uses or specifies an encoding when generating output to a downstream component
CWE-839|Numeric Range Comparison Without Minimum Check|The program checks a value to ensure that it does not exceed a maximum
CWE-84|Improper Neutralization of Encoded URI Schemes in a Web Page|The web application improperly neutralizes user-controlled input for executable script disguised with URI encodings.
CWE-841|Improper Enforcement of Behavioral Workflow|The software supports a session in which more than one behavior must be performed by an actor
CWE-842|Placement of User into Incorrect Group|The software or the administrator places a user into an incorrect group.
CWE-843|Access of Resource Using Incompatible Type (Type Confusion)|The program allocates or initializes a resource such as a pointer
CWE-85|Doubled Character XSS Manipulations|The web application does not filter user-controlled input for executable script disguised using doubling of the involved characters.
CWE-86|Improper Neutralization of Invalid Characters in Identifiers in Web Pages|The software does not neutralize or incorrectly neutralizes invalid characters or byte sequences in the middle of tag names
CWE-862|Missing Authorization|The software does not perform an authorization check when an actor attempts to access a resource or perform an action.
CWE-863|Incorrect Authorization|The software performs an authorization check when an actor attempts to access a resource or perform an action
CWE-87|Improper Neutralization of Alternate XSS Syntax|The software does not neutralize or incorrectly neutralizes user-controlled input for alternate script syntax.
CWE-88|Argument Injection or Modification|The software does not sufficiently delimit the arguments being passed to a component in another control sphere
CWE-89|Improper Neutralization of Special Elements used in an SQL Command (SQL Injection)|The software constructs all or part of an SQL command using externally-influenced input from an upstream component
CWE-9|J2EE Misconfiguration: Weak Access Permissions for EJB Methods|If elevated access rights are assigned to EJB methods
CWE-90|Improper Neutralization of Special Elements used in an LDAP Query (LDAP Injection)|The software constructs all or part of an LDAP query using externally-influenced input from an upstream component
CWE-908|Use of Uninitialized Resource|The software uses a resource that has not been properly initialized.
CWE-909|Missing Initialization of Resource|The software does not initialize a critical resource.
CWE-91|XML Injection (aka Blind XPath Injection)|The software does not properly neutralize special elements that are used in XML
CWE-910|Use of Expired File Descriptor|The software uses or accesses a file descriptor after it has been closed.
CWE-911|Improper Update of Reference Count|The software uses a reference count to manage a resource
CWE-912|Hidden Functionality|The software contains functionality that is not documented
CWE-913|Improper Control of Dynamically-Managed Code Resources|The software does not properly restrict reading from or writing to dynamically-managed code resources such as variables
CWE-914|Improper Control of Dynamically-Identified Variables|The software does not properly restrict reading from or writing to dynamically-identified variables.
CWE-915|Improperly Controlled Modification of Dynamically-Determined Object Attributes|The software receives input from an upstream component that specifies multiple attributes
CWE-916|Use of Password Hash With Insufficient Computational Effort|The software generates a hash for a password
CWE-917|Improper Neutralization of Special Elements used in an Expression Language Statement (Expression Language Injection)|The software constructs all or part of an expression language (EL) statement in a Java Server Page (JSP) using externally-influenced input from an upstream component
CWE-918|Server-Side Request Forgery (SSRF)|The web server receives a URL or similar request from an upstream component and retrieves the contents of this URL
CWE-920|Improper Restriction of Power Consumption|The software operates in an environment in which power is a limited resource that cannot be automatically replenished
CWE-921|Storage of Sensitive Data in a Mechanism without Access Control|The software stores sensitive information in a file system or device that does not have built-in access control.
CWE-922|Insecure Storage of Sensitive Information|The software stores sensitive information without properly limiting read or write access by unauthorized actors.
CWE-923|Improper Restriction of Communication Channel to Intended Endpoints|The software establishes a communication channel to (or from) an endpoint for privileged or protected operations
CWE-924|Improper Enforcement of Message Integrity During Transmission in a Communication Channel|The software establishes a communication channel with an endpoint and receives a message from that endpoint
CWE-925|Improper Verification of Intent by Broadcast Receiver|The Android application uses a Broadcast Receiver that receives an Intent but does not properly verify that the Intent came from an authorized source.
CWE-926|Improper Export of Android Application Components|The Android application exports a component for use by other applications
CWE-927|Use of Implicit Intent for Sensitive Communication|The Android application uses an implicit intent for transmitting sensitive data to other applications.
CWE-93|Improper Neutralization of CRLF Sequences (CRLF Injection)|The software uses CRLF (carriage return line feeds) as a special element
CWE-939|Improper Authorization in Handler for Custom URL Scheme|The software uses a handler for a custom URL scheme
CWE-94|Improper Control of Generation of Code (Code Injection)|The software constructs all or part of a code segment using externally-influenced input from an upstream component
