CVE|CWE|repo|files|additions|deletions|how
CVE-2015-2312|CWE-400|https: //github.com/capnproto/capnproto|3.0|86.0|3.0|control over a very long list is added to prevent an excessively high size from being set arbitrarily and leading to dos and consumption attacks of the cpu 
CVE-2017-14500|CWE-78|https: //github.com/akrennmair/newsbeuter|2.0|4.0|4.0|the metacharacters of the filename are replaced to avoid that inside them there are shell commands 
CVE-2017-11462|CWE-415|https: //github.com/krb5/krb5|17.0|72.0|21.0|the security context is prevented from being eliminated following a call error 
CVE-2016-2043|CWE-79|https: //github.com/phpmyadmin/phpmyadmin|1.0|1.0|1.0|the escapeHtml function is added to the line to prevent HTML code being injected into a table name 
CVE-2018-1000524|CWE-190|https: //github.com/fatcerberus/minisphere|1.0|4.0|1.0|a buffer size check is added as this caused an integer overflow 
CVE-2018-11756|CWE-264|https: //github.com/apache/incubator-openwhisk-runtime-php|6.0|87.0|87.0|the re-initialization of the function is disabled 
CVE-2016-4804|CWE-119|https: //github.com/dosfstools/dosfstools|2.0|12.0|4.0|replaces the buffer size from unsigned to off_t and the check is added if the buffer is too small for the data 
CVE-2016-9183|CWE-200|https: //github.com/exponentcms/exponent-cms|2.0|3.0|1.0|the escape function is added to the input to avoid sql injection 
CVE-2017-14695|CWE-22|https: //github.com/saltstack/salt|2.0|14.0|11.0|I am eliminating path separators in the minion id to avoid false authentications 
CVE-2016-7168|CWE-79|https: //github.com/WordPress/WordPress|2.0|2.0|2.0|the filename of uploaded images is sanitized to avoid web injection 
CVE-2017-11593|CWE-79|https: //github.com/volca/markdown-preview|6.0|1286.0|2.0|the text is sanitized to avoid web injection 
CVE-2018-12466|CWE-264|https: //github.com/openSUSE/open-build-service|1.0|5.0|2.0|a check is added to prevent authenticated users from accessing the project link through which they could delete it 
CVE-2015-5460|CWE-79|https: //github.com/Snorby/snorby|1.0|2.0|2.0|the text is sanitized to avoid web injection 
CVE-2017-13006|CWE-119|https: //github.com/the-tcpdump-group/tcpdump|4.0|219.0|46.0|control over the length of the buffer is added to avoid over-reading of the buffer in various functions 
CVE-2013-7251|CWE-352|https: //github.com/micromata/projectforge-webapp|20.0|165.0|20.0|cross site request forgery token is added to prevent arbitrary users from authenticating 
CVE-2018-16149|CWE-347|https: //github.com/igrr/axtls-8266|2.0|76.0|38.0|the verification sign is modified so that it is based not only on the length but also on the type 
CVE-2018-8097|CWE-94|https: //github.com/pyeve/eve|1.0|9.0|6.0|the where clause is modified to avoid code injection 
CVE-2017-17094|CWE-79|https: //github.com/WordPress/WordPress|2.0|3.0|3.0|the escape function is added for the url to avoid code injection 
CVE-2014-8176|CWE-119|https: //github.com/openssl/openssl|1.0|6.0|3.0|a structure is not allowed to be free in the interval between a ChangeCipherSpec message and a Finished message 
CVE-2016-10268|CWE-191|https: //github.com/vadz/libtiff|2.0|8.0|1.0|a buffer size check is placed to avoid buffer overflow 
CVE-2014-9496|CWE-119|https: //github.com/erikd/libsndfile|11.0|11.0|1.0|buffer cut control to avoid overflow 
CVE-2017-14639|CWE-119|https: //github.com/axiomatic-systems/Bento4|1.0|3.0|3.0|the incorrect types of characters of the data that would have caused stack-based buffer underflows and out-of-bounds are replaced 
CVE-2015-7294|CWE-90|https: //github.com/vesse/node-ldapauth-fork|2.0|16.0|1.0|the input is sanitized 
CVE-2018-10861|CWE-287|https: //github.com/ceph/ceph|6.0|464.0|22.0|changes are made to prevent users with read access from modifying and deleting from storage or corrupting images 
CVE-2015-2141|CWE-200|https: //github.com/weidai11/cryptopp|1.0|7.0|1.0|the private key is hidden by a squaring operation 
CVE-2018-10095|CWE-79|https: //github.com/Dolibarr/dolibarr|1.0|6.0|7.0|checks are carried out on the validity of the input to avoid web injection 
CVE-2017-5553|CWE-79|https: //github.com/b2evolution/b2evolution|1.0|5.0|4.0|only correct urls (starting with http: // https: // or /) are accepted to avoid web injection 
CVE-2017-9434|CWE-125|https: //github.com/weidai11/cryptopp|3.0|14.0|4.0|distance control to avoid out of bound read 
CVE-2014-3498|CWE-20|https: //github.com/ansible/ansible|5.0|41.0|19.0|removes tags from strings when the json comes from unknown sources to avoid code injection 
CVE-2011-1589|CWE-22|https: //github.com/kraih/mojo|4.0|25.0|4.0|the uri path is normalized to avoid reading files through a particular sequence of characters (... / ... / ...) 
CVE-2018-8099|CWE-415|https: //github.com/libgit2/libgit2|1.0|13.0|9.0|the return value of a function that causes denial of service is modified 
CVE-2016-6354|CWE-119|https: //github.com/westes/flex|1.0|1.0|1.0|is replaced by a so-called integer type that causes heap based buffer 
CVE-2012-0036|CWE-89|https: //github.com/bagder/curl|5.0|62.0|31.0|a function is added that decodes a url only if it contains no code inside it 
CVE-2017-7863|CWE-787|https: //github.com/FFmpeg/FFmpeg|1.0|14.0|1.0|buffer size check to avoid heap based buffer overflow 
CVE-2018-7408|CWE-284|https: //github.com/npm/npm|9.0|28.0|28.0|replaced ../utils/correct-mkdir.js with mkdirp to prevent users of the etc and usr folders from bypassing the file permissions 
CVE-2016-7525|CWE-125|https: //github.com/ImageMagick/ImageMagick|1.0|1.0|1.0|size buffer check for heap based buffer overflow 
CVE-2013-4880|CWE-79|https: //github.com/bigtreecms/BigTree-CMS|1.0|1.0|1.0|added htmlspecialcharaters function to avoid web injection 
CVE-2015-1432|CWE-352|https: //github.com/phpbb/phpbb|1.0|5.0|1.0|the validation of the previously encouraged form is modified 
CVE-2016-10127|CWE-611|https: //github.com/rohe/pysaml2|7.0|95.0|6.0|the SAML XML request and response parsing is modified to avoid XXE attacks 
CVE-2011-3592|CWE-79|https: //github.com/phpmyadmin/phpmyadmin|2.0|2.0|1.0|replaced html function with text to avoid web injection 
CVE-2016-4849|CWE-79|https: //github.com/ivywe/geeklog-ivywe|3.0|3.0|3.0|added function htmlspecialchars web injection 
CVE-2016-4797|CWE-369|https: //github.com/uclouvain/openjpeg|2.0|4.0|1.0|eliminated division by zero 
CVE-2016-10169|CWE-125|https: //github.com/dbry/WavPack|2.0|9.0|1.0|data control to avoid out of bound read 
CVE-2016-8654|CWE-119|https: //github.com/mdadams/jasper|2.0|15.0|13.0|modified buffer size which was too small in some cases 
CVE-2018-14680|CWE-20|https: //github.com/kyz/libmspack|2.0|16.0|3.0|empty filenames are considered errors 
CVE-2018-16359|CWE-284|https: //github.com/google/gvisor|1.0|0.0|5.0|the system calls that were used to rename files on the OS host are removed 
CVE-2014-2669|CWE-189|https: //github.com/postgres/postgres|15.0|177.0|19.0|buffer size check to avoid overflow 
CVE-2017-11719|CWE-125|https: //github.com/FFmpeg/FFmpeg|1.0|6.0|2.0|check to avoid out of bound array 
CVE-2015-2310|CWE-190|https: //github.com/capnproto/capnproto|1.0|4.0|3.0|check to prevent integer overflow 
CVE-2017-11328|CWE-119|https: //github.com/VirusTotal/yara|3.0|16.0|1.0|control to avoid overflow on array capacity 
CVE-2014-5352|CWE-Other|https: //github.com/krb5/krb5|14.0|36.0|13.0|a function is modified to avoid eliminating the constancy leaving the caller with a pointer without knowing if it is valid, the context is then marked as terminated instead of deleting it 
CVE-2017-12995|CWE-399|https: //github.com/the-tcpdump-group/tcpdump|10.0|33.0|18.0|a change is made to prevent a loop from going into a loop 
CVE-2018-1281|CWE-200|https: //github.com/dmlc/ps-lite|1.0|2.0|1.0|control on the host to prevent the port from being accessible from all interfaces on the web 
CVE-2016-10160|CWE-119|https: //github.com/php/php-src|3.0|17.0|2.0|control over the alias del phar 
CVE-2012-4395|CWE-79|https: //github.com/owncloud/core|1.0|1.0|1.0|strips url to solve xss vulnerability 
CVE-2012-1188|CWE-79|https: //github.com/forkcms/forkcms|1.0|1.0|1.0|htmlspecialchars to resolve xss vulnerability 
CVE-2012-6550|CWE-79|https: //github.com/jonrohan/ZeroClipboard|3.0|2.0|1.0|" ""the text is split with"" ""via"" ""and join with"" "" injection """
CVE-2014-8275|CWE-310|https: //github.com/openssl/openssl|1.0|1.0|1.0|the security of a certificate is strengthened 
CVE-2016-10268|CWE-191|https: //github.com/vadz/libtiff|2.0|8.0|1.0|size control to avoid buffer overflow 
CVE-2014-3498|CWE-20|https: //github.com/ansible/ansible|5.0|41.0|19.0|removes tags from strings when the json comes from unknown sources to avoid code injection 
CVE-2017-16355|CWE-200|https: //github.com/phusion/passenger|1.0|2.0|1.0|check to avoid accessing files on a system 
CVE-2018-14345|CWE-264|https: //github.com/sddm/sddm|2.0|3.0|3.0|check that authentication was successful before unlocking the session 
CVE-2018-1129|CWE-287|https: //github.com/ceph/ceph|1.0|78.0|32.0|enhanced signature security 
CVE-2018-16642|CWE-787|https: //github.com/ImageMagick/ImageMagick|1.0|94.0|61.0|size control for an out of bounds write 
CVE-2017-6350|CWE-190|https: //github.com/vim/vim|2.0|5.0|4.0|check if the size is too large to avoid overflow 
CVE-2017-15734|CWE-352|https: //github.com/thorsten/phpMyFAQ|1.0|12.0|4.0|added CSRF protection cross site request forgery 
CVE-2015-1342|CWE-264|https: //github.com/lxc/lxcfs|4.0|646.0|46.0|control over escape directories 
CVE-2018-18467|CWE-20|https: //github.com/siacs/Conversations|5.0|37.0|18.0|the text of a message shared via xmpp is now added only if draft box is empty 
CVE-2018-6767|CWE-119|https: //github.com/dbry/WavPack|1.0|32.0|7.0|control size to avoid over read buffer 
CVE-2014-3771|CWE-264|https: //github.com/nilsteampassnet/TeamPass|10.0|241.0|32.0|security measures are increased so as not to bypass access restrictions 
CVE-2012-2935|CWE-79|https: //github.com/osCommerce/oscommerce|2.0|2.0|2.0|added outputProtected function to avoid web injection 
CVE-2012-3408|CWE-287|https: //github.com/puppetlabs/puppet|2.0|32.0|5.0|added deprecated IP check 
CVE-2018-19044|CWE-59|https: //github.com/acassen/keepalived|14.0|63.0|23.0|control on symlinks in pathnames in temporary data 
CVE-2017-8326|CWE-19|https: //github.com/jsummers/imageworsener|2.0|10.0|7.0|correct shift operation invalid 
CVE-2015-2778|CWE-399|https: //github.com/quassel/quassel|7.0|124.0|71.0|introduces a new type of splitting algorithm 
CVE-2016-10159|CWE-190|https: //github.com/php/php-src|3.0|18.0|2.0|check on the size of the buffer to avoid integer overflow 
CVE-2012-1910|CWE-Other|https: //github.com/bitcoin/bitcoin|2.0|3.0|2.0|RPC crashes are fixed on windows 
CVE-2017-14498|CWE-79|https: //github.com/silverstripe/silverstripe-framework|1.0|1.0|1.0|the default svg upload is deleted 
CVE-2017-16806|CWE-22|https: //github.com/Ulterius/server|78.0|2976.0|4686.0|fix broken GPU detection code 
CVE-2017-15201|CWE-264|https: //github.com/kanboard/kanboard|20.0|112.0|120.0|removed the visible ids from the forms 
CVE-2012-1122|CWE-264|https: //github.com/mantisbt/mantisbt|1.0|2.0|2.0|inserted check for authenticated users with the bug threshold report related to the target project and not to the current project 
CVE-2018-11652|CWE-78|https: //github.com/sullo/nikto|2.0|26.0|17.0|to avoid csv injection cells starting with characters that could be malicious are preceded by 'mark 
CVE-2018-15473|CWE-200|https: //github.com/openbsd/src|3.0|28.0|19.0|saving for disabled users was delayed until after the package containing the request was parried 
CVE-2011-3591|CWE-79|https: //github.com/phpmyadmin/phpmyadmin|3.0|17.0|5.0|html escape to avoid web injection 
CVE-2018-7254|CWE-119|https: //github.com/dbry/WavPack|1.0|23.0|7.0|check size buffer and function malloc to avoid buffer overflow and invalid memory allocation 
CVE-2018-14474|CWE-601|https: //github.com/s-gv/orangeforum|1.0|2.0|2.0|prevents redirection after sign in o sign up 
CVE-2015-0205|CWE-310|https: //github.com/openssl/openssl|1.0|1.0|1.0|avoids the use of DH certificates without a verification message 
CVE-2017-16802|CWE-79|https: //github.com/MISP/MISP|2.0|2.0|2.0|" ""check on the names of the organizations that contain"" ""js"" ""inside them"" "
CVE-2018-1000524|CWE-190|https: //github.com/fatcerberus/minisphere|1.0|4.0|1.0|malloc is moved to a separate line to avoid integer overflow 
CVE-2016-5357|CWE-20|https: //github.com/wireshark/wireshark|2.0|40.0|64.0|check on the sign of the packet length which must not be negative 
CVE-2016-5734|CWE-94|https: //github.com/phpmyadmin/phpmyadmin|1.0|14.0|1.0|only the delimiter not present in the search expressions are allowed to avoid the introduction of php code 
CVE-2012-1226|CWE-22|https: //github.com/Dolibarr/dolibarr|10.0|70.0|66.0|check on file and backtopage parameters to avoid arbitrarily executing file or code 
CVE-2013-2035|CWE-94|https: //github.com/fusesource/hawtjni|1.0|29.0|50.0|the extraction of shared libraries is simplified, in particular a control is added when the paths of custom libraries are not specified, via which could execute java code by overwriting a jar file in temporary files. 
CVE-2018-9918|CWE-399|https: //github.com/qpdf/qpdf|7.0|33.0|99.0|arbitrarily limits the depth of the data structure represented by the direct objects 
CVE-2018-12559|CWE-22|https: //github.com/CDrummond/cantata|38.0|45.0|2034.0|the internal samba share code is deleted 
CVE-2017-6503|CWE-79|https: //github.com/qbittorrent/qBittorrent|6.0|21.0|8.0|htmlescape added to avoid XSS 
CVE-2016-10172|CWE-125|https: //github.com/dbry/WavPack|2.0|9.0|1.0|size control to avoid out of bound read 
CVE-2016-7514|CWE-125|https: //github.com/ImageMagick/ImageMagick|1.0|2.0|2.0|size control to avoid overflow 
CVE-2015-8310|CWE-79|https: //github.com/devsnd/cherrymusic|2.0|8.0|3.0|htlm escape for XSS 
CVE-2012-4396|CWE-79|https: //github.com/owncloud/core|1.0|9.0|3.0|fix xss in multiselect 
CVE-2012-1190|CWE-79|https: //github.com/phpmyadmin/phpmyadmin|1.0|5.0|5.0|the database names are no longer passed as html 
CVE-2018-11118|CWE-79|https: //github.com/ILIAS-eLearning/ILIAS|1.0|12.0|16.0|all <a> targets are set to blank 
CVE-2014-7138|CWE-79|https: //github.com/pderksen/WP-Google-Calendar-Events|1.0|16.0|16.0|html escape for xss 
CVE-2018-18206|CWE-190|https: //github.com/Bytom/bytom/|1.0|1.0|1.0|avoids that ids are negative through convert int 
CVE-2017-17713|CWE-89|https: //github.com/boxug/trape|3.0|54.0|36.0|correct some insert sql error that cause sql injection 
CVE-2015-2298|CWE-200|https: //github.com/ether/etherpad-lite|1.0|11.0|1.0|correct an improver substring check when exporting a pad id 
CVE-2017-18239|CWE-361|https: //github.com/jasongoodwin/authentikat-jwt|1.0|1.0|1.0|comparison between signatures is done bit by bit 
CVE-2015-5395|CWE-352|https: //github.com/inverse-inc/sogo|40.0|224.0|129.0|added AngularJS XSRF support 
CVE-2013-7022|CWE-119|https: //github.com/FFmpeg/FFmpeg|1.0|2.0|2.0|control on the framebuffer to avoid out of bounds array access 
CVE-2012-5482|CWE-264|https: //github.com/openstack/glance|2.0|24.0|9.0|added permission check to delete images 
CVE-2014-5353|CWE-Other|https: //github.com/krb5/krb5|1.0|4.0|3.0|in case a query does not return results, its status is changed from success to KRB5_KDB_NOENTRY 
CVE-2013-2025|CWE-79|https: //github.com/rjmackay/Ushahidi_Web|409.0|27911.0|180.0|various techniques (6) to avoid XSS (described in detail in the fix commit) 
CVE-2015-8958|CWE-125|https: //github.com/ImageMagick/ImageMagick|1.0|1.0|14.0|eliminated checking and launching the exception CorruptImageError 
CVE-2015-8895|CWE-190|https: //github.com/ImageMagick/ImageMagick|9.0|57.0|29.0|size control to avoid integer overflow 
CVE-2018-7584|CWE-119|https: //github.com/php/php-src|2.0|34.0|2.0|added check on reading before the buffer starts 
CVE-2013-4372|CWE-79|https: //github.com/jboss-fuse/fuse|3.0|5.0|5.0|added HTML escape to avoid XSS 
CVE-2018-17605|CWE-22|https: //github.com/bertramdev/asset-pipeline|3.0|5.0|2.0|the file path is normalized by the AssetHelper function 
CVE-2016-2315|CWE-119|https: //github.com/git/git|9.0|26.0|58.0|the complete pathname is passed to the callbacks 
CVE-2013-4119|CWE-476|https: //github.com/FreeRDP/FreeRDP|4.0|7.0|3.0|Clients are prevented from logging out before authentication is terminated 
CVE-2015-3902|CWE-352|https: //github.com/phpmyadmin/phpmyadmin|9.0|33.0|24.0|control to avoid CSRF in the setup process 
CVE-2016-1246|CWE-119|https: //github.com/perl5-dbi/DBD-mysql|1.0|3.0|3.0|check on the length of the sprintf input variable to avoid overflow 
CVE-2017-2598|CWE-326|https: //github.com/jenkinsci/jenkins|14.0|517.0|88.0|the new secrets are encrypted with CBC instead of ECB 
CVE-2018-1999024|CWE-79|https: //github.com/mathjax/MathJax|2.0|9.0|6.0|added regular expression and replace to avoid xss 
CVE-2014-9767|CWE-22|https: //github.com/facebook/hhvm|5.0|259.0|8.0|zip file paths are normalized 
CVE-2017-5510|CWE-787|https: //github.com/ImageMagick/ImageMagick|1.0|1.0|1.0|modified the function that acquires the information of an image to avoid writing out of bounds through a craft psd file 
CVE-2010-4802|CWE-20|https: //github.com/kraih/mojo|2.0|2.0|4.0|deleted control on variable $ name 
CVE-2017-1000443|CWE-79|https: //github.com/Eleix/openhacker|17.0|212.0|97.0|added sanitization on message details for banking transactions, and validation for sending money 
CVE-2017-6952|CWE-190|https: //github.com/aquynh/capstone|1.0|11.0|2.0|check to prevent integer overflow 
CVE-2013-6371|CWE-310|https: //github.com/json-c/json-c|11.0|691.0|13.0|added hash function to avoid denial of service via json data handcrafted 
CVE-2017-18016|CWE-254|https: //github.com/paritytech/parity|13.0|85.0|48.0|added token check 
CVE-2012-4397|CWE-79|https: //github.com/owncloud/core|2.0|2.0|2.0|htmlspecialchars to delete xss 
CVE-2017-15569|CWE-79|https: //github.com/redmine/redmine|1.0|2.0|1.0|html escape in multivalue fields 
CVE-2016-8869|CWE-20|https: //github.com/joomla/joomla-cms|3.0|5.0|86.0|the registration method is canceled 
CVE-2015-2318|CWE-295|https: //github.com/mono/mono|4.0|59.0|21.0|added handshake state validation 
CVE-2017-0907|CWE-918|https: //github.com/recurly/recurly-client-net|14.0|52.0|52.0|replaced escapeUriString with EscapeDataString 
CVE-2017-7946|CWE-416|https: //github.com/radare/radare2|1.0|51.0|41.0|replaced malloc with calloc 
CVE-2015-5659|CWE-89|https: //github.com/NaCl-Ltd/pref-shimane-cms|1.0|2.0|6.0|a piece of code is deleted 
CVE-2017-2809|CWE-94|https: //github.com/tomoh1r/ansible-vault|10.0|55.0|29.0|the function yaml.safe_load () and tomohlr is added 
CVE-2017-2298|CWE-20|https: //github.com/puppetlabs/mcollective-sshkey-security|2.0|29.0|10.0|added check that refuses the identity if it results in the cross folder 
CVE-2013-7226|CWE-189|https: //github.com/php/php-src|4.0|173.0|37.0|control size to avoid heap based buffer overflow 
CVE-2013-1630|CWE-20|https: //github.com/mardiros/pyshop|4.0|3472.0|3.0|improves security when downloading from pypi 
CVE-2013-4249|CWE-79|https: //github.com/django/django|2.0|15.0|9.0|added autoescaping to avoid web injection 
CVE-2018-12453|CWE-704|https: //github.com/antirez/redis|1.0|1.0|1.0|abort command XGROUP if the key is not a stream 
CVE-2018-11118|CWE-79|https: //github.com/ILIAS-eLearning/ILIAS|1.0|10.0|2.0|uri manipulations to prevent xss 
CVE-2012-1013|CWE-Other|https: //github.com/krb5/krb5|1.0|1.0|1.0|added check if password is equal to null 
CVE-2014-0237|CWE-399|https: //github.com/file/file|1.0|6.0|14.0|removed the loop that kept reading the same offset 
CVE-2015-1789|CWE-119|https: //github.com/openssl/openssl|1.0|47.0|10.0|check lenght field to avoid out-of-bounds reads 
CVE-2017-17089|CWE-79|https: //github.com/webmin/webmin|1.0|3.0|2.0|htlm escape to avoid xss 
CVE-2017-13010|CWE-119|https: //github.com/the-tcpdump-group/tcpdump|4.0|20.0|9.0|check on string comparison to avoid buffer over-read 
CVE-2018-13447|CWE-89|https: //github.com/Dolibarr/dolibarr|4.0|35.0|28.0|added filter to avoid sql injection 
CVE-2018-14359|CWE-119|https: //github.com/neomutt/neomutt|6.0|20.0|12.0|check lenght to avoid buffer overflow 
CVE-2014-8335|CWE-255|https: //github.com/lesterchan/wp-dbmanager|5.0|28.0|24.0|added use of escapeshellcmd and avoids uploading files within queries 
CVE-2016-8339|CWE-119|https: //github.com/antirez/redis|1.0|5.0|3.0|control added if client is master 
CVE-2018-15853|CWE-399|https: //github.com/xkbcommon/libxkbcommon|1.0|1.0|1.0|recursion performed on! True instead of only true and false to avoid infinite recursion and stack overflow 
CVE-2016-10170|CWE-125|https: //github.com/dbry/WavPack|2.0|9.0|1.0|size control to avoid out of bound read 
CVE-2012-1059|CWE-79|https: //github.com/osCommerce/oscommerce|2.0|2.0|2.0|added outputprotected function to avoid xss 
CVE-2013-4492|CWE-79|https: //github.com/svenfuchs/i18n|2.0|32.0|6.0|escape and other controls to avoid xss 
CVE-2016-6912|CWE-415|https: //github.com/libgd/libgd|6.0|81.0|30.0|added a static function that checks the width and height to see if they are too large 
CVE-2018-9336|CWE-415|https: //github.com/OpenVPN/openvpn|1.0|11.0|12.0|check that the directory is not null for all error cases for which a label has also been added 
CVE-2017-15213|CWE-79|https: //github.com/Flyspray/flyspray|1.0|2.0|2.0|added filter to avoid xss 
CVE-2014-1869|CWE-79|https: //github.com/zeroclipboard/zeroclipboard|2.0|13.0|3.0|text sanitization to avoid xss 
CVE-2015-7348|CWE-79|https: //github.com/zTree/zTree_v3|4.0|8.0|14.0|htlmspecialchars to avoid xss 
CVE-2017-9432|CWE-787|https: //github.com/fosnola/libstaroffice|1.0|1.0|1.0|check index loop to avoid out of bounds write 
CVE-2015-8771|CWE-94|https: //github.com/gosa-project/gosa-core|2.0|3.0|3.0|added base64 encoding to avoid code injection 
CVE-2018-1000053|CWE-352|https: //github.com/LimeSurvey/LimeSurvey|2.0|8.0|5.0|check to avoid CRSF in themes not installed 
CVE-2017-1000189|CWE-20|https: //github.com/mde/ejs|2.0|25.0|7.0|strengthened control over the validity of the inputs 
CVE-2018-17057|CWE-502|https: //github.com/tecnickcom/TCPDF|6.0|49.0|32.0|added TCPDF_STATIC function to check that non-serialized objects are sent in phar: // wrapper 
CVE-2017-13055|CWE-119|https: //github.com/the-tcpdump-group/tcpdump|5.0|194.0|272.0|added check to avoid over read buffer 
CVE-2017-0907|CWE-918|https: //github.com/recurly/recurly-client-net|14.0|52.0|52.0|replace EscapeUriString with EscapeDataString 
CVE-2014-9528|CWE-89|https: //github.com/humhub/humhub|4.0|23.0|8.0|invert xssClean and stripTags 
CVE-2011-4596|CWE-22|https: //github.com/openstack/nova|5.0|23.0|1.0|synitization EC2 manifest and image tarballs 
CVE-2016-10127|CWE-611|https: //github.com/rohe/pysaml2|7.0|95.0|6.0|check sml or xml response or request to avoid XXE 
CVE-2017-9996|CWE-119|https: //github.com/FFmpeg/FFmpeg|1.0|1.0|1.0|added control on the parameter format 
CVE-2017-1000423|CWE-20|https: //github.com/b2evolution/b2evolution|1.0|19.0|7.0|the format_install_param function that replaces is added 
CVE-2015-1331|CWE-59|https: //github.com/lxc/lxc|2.0|11.0|38.0|/ run / lock / lxc is replaced with / run / lxc / lock to prevent users without permission to use lxc to create arbitrarily file on the ystem 
CVE-2017-13000|CWE-119|https: //github.com/the-tcpdump-group/tcpdump|4.0|3.0|1.0|" ""is deleted"" ""+2"" ""inside the print to avoid buffer over read"" "
CVE-2016-7163|CWE-190|https: //github.com/uclouvain/openjpeg|1.0|1.0|1.0|cast to size_t before multiplication to prevent buffer overflow and integer overflow 
CVE-2016-6494|CWE-200|https: //github.com/mongodb/mongo|2.0|115.0|2.0|check that no wrong permissions are assigned when dbshell is created 
CVE-2012-1190|CWE-79|https: //github.com/phpmyadmin/phpmyadmin|1.0|5.0|5.0|check that the database names are not put as html 
CVE-2016-5356|CWE-119|https: //github.com/wireshark/wireshark|1.0|29.0|46.0|check on the sign of the packet length which must not be negative 
CVE-2014-5017|CWE-89|https: //github.com/LimeSurvey/LimeSurvey|1.0|6.0|5.0|check search parameter to avoid sql injection 
CVE-2013-7226|CWE-189|https: //github.com/php/php-src|4.0|173.0|37.0|check dimension value to avoid heap-based buffer overflow 
CVE-2017-9226|CWE-787|https: //github.com/kkos/oniguruma|1.0|2.0|2.0|check that octal value are smaller than 256 
CVE-2013-4789|CWE-89|https: //github.com/Cotonti/Cotonti|1.0|1.0|1.0|count if the variable is set to avoid sql injection 
CVE-2016-5731|CWE-79|https: //github.com/phpmyadmin/phpmyadmin|1.0|3.0|3.0|added htlm specialchars to avoid xss 
CVE-2016-3698|CWE-284|https: //github.com/jpirko/libndp|1.0|40.0|11.0|added IPv6 hop limit validation 
CVE-2017-13013|CWE-119|https: //github.com/the-tcpdump-group/tcpdump|5.0|173.0|116.0|If the protocol type isn't ETHERTYPE_IP or ETHERTYPE_TRAIL, or if the protocol address length isn't 4, don't print the address as an IPv4 address 
CVE-2012-6640|CWE-79|https: //github.com/horde/horde|2.0|14.0|14.0|Only basic display image attachments in the browser to avoid XSS 
CVE-2012-1902|CWE-200|https: //github.com/phpmyadmin/phpmyadmin|2.0|6.0|1.0|check if the configuration file exists 
CVE-2016-5361|CWE-20|https: //github.com/libreswan/libreswan|1.0|4.0|4.0|Do not schedule retransmits for inI1outR1 packets (prevent DDOS) Do schedule retransmits for XAUTH packets 
CVE-2018-0046|CWE-79|https: //github.com/OpenNMS/opennms|2.0|95.0|68.0|Fixed the Asset pages JSPs to handle ACL filtering 
CVE-2015-8547|CWE-17|https: //github.com/quassel/quassel|1.0|1.0|1.0|added check if the buffer is of type channelBuffer 
CVE-2012-4396|CWE-79|https: //github.com/owncloud/core|2.0|3.0|3.0|user input sync by htmlentities to avoid xss 
