CVE|CWE|repo|files|additions|deletions|how
CVE-2016-4069|CWE-352|https: //github.com/roundcube/roundcubemail|14.0|50.0|16.0|added a single request token to avoid CSRF via download urls 
CVE-2017-9063|CWE-79|https: //github.com/WordPress/WordPress|5.0|32.0|4.0|invalid custom sessions are ignored 
CVE-2017-15208|CWE-264|https: //github.com/kanboard/kanboard|20.0|112.0|120.0|ids are not displayed in form 
CVE-2011-2931|CWE-79|https: //github.com/rails/rails|2.0|8.0|1.0|added strip to invalid names to prevent xss 
CVE-2017-6903|CWE-254|https: //github.com/ioquake/ioq3|3.0|15.0|2.0|added file check 
CVE-2012-6708|CWE-79|https: //github.com/jquery/jquery|5.0|21.0|12.0|added check if the html code starts with '<' and not contained within the string 
CVE-2018-17552|CWE-89|https: //github.com/NavigateCMS/Navigate-CMS|72.0|1969.0|905.0|all sql queries are parameterized 
CVE-2012-4396|CWE-79|https: //github.com/owncloud/core|1.0|1.0|1.0|sinitization of user input via htmlentities to avoid xss 
CVE-2017-6503|CWE-79|https: //github.com/qbittorrent/qBittorrent|6.0|21.0|8.0|htmlescape added to avoid xss 
CVE-2016-5690|CWE-476|https: //github.com/ImageMagick/ImageMagick|2.0|13.0|4.0|pixel control via GetquantumRange 
CVE-2015-6240|CWE-59|https: //github.com/ansible/ansible|2.0|93.0|61.0|various changes to fix the problem in plugins 
CVE-2017-7481|CWE-20|https: //github.com/ansible/ansible|4.0|31.0|3.0|added to global lookup param and cfg option to allow unsafe return values, even in the jinja2 environment 
CVE-2015-2694|CWE-264|https: //github.com/krb5/krb5|2.0|9.0|5.0|added check that the data bytes are not zero 
CVE-2013-7225|CWE-89|https: //github.com/fatfreecrm/fat_free_crm|2.0|10.0|6.0|Refactor activity_user to remove possible SQL injection points. 
CVE-2018-12562|CWE-20|https: //github.com/CDrummond/cantata|38.0|45.0|2304.0|the internal samba share code is deleted 
CVE-2017-15727|CWE-79|https: //github.com/thorsten/phpMyFAQ|1.0|5.0|1.0|Prevent users to upload HTML as attachments 
CVE-2018-14857|CWE-434|https: //github.com/OCSInventory-NG/OCSInventory-ocsreports|5.0|68.0|16.0|added the check that only the uploaded html files are valid 
CVE-2016-3952|CWE-255|https: //github.com/web2py/web2py|1.0|0.0|2.0|delete the global settings from the request object 
CVE-2016-6897|CWE-352|https: //github.com/WordPress/WordPress|45.0|3628.0|926.0|is installed / updated shiny updatee v2 
CVE-2013-4372|CWE-79|https: //github.com/jboss-fuse/fuse|3.0|5.0|5.0|escapeHTML to avoid xss 
CVE-2014-0040|CWE-noinfo|https: //github.com/openstack/heat-templates|6.0|19.0|27.0|updated some security options and change from http to https 
CVE-2014-1985|CWE-20|https: //github.com/redmine/redmine|2.0|9.0|3.0|added control on the parameter url back 
CVE-2017-6387|CWE-125|https: //github.com/radare/radare2|2.0|3.0|3.0|check size to avoid out of bounds read 
CVE-2016-9540|CWE-119|https: //github.com/vadz/libtiff|2.0|9.0|2.0|check image width to avoid 
CVE-2016-1000232|CWE-20|https: //github.com/salesforce/tough-cookie|2.0|19.0|12.0|fix-too-many-semicolons 
CVE-2018-14353|CWE-191|https: //github.com/neomutt/neomutt|1.0|2.0|2.0|check size to avoid integer overflow 
CVE-2017-14767|CWE-119|https: //github.com/FFmpeg/FFmpeg|1.0|1.0|1.0|check size to avoid heap-buffer-overflow 
CVE-2012-1190|CWE-79|https: //github.com/phpmyadmin/phpmyadmin|1.0|5.0|5.0|the database names are not entered as html 
CVE-2018-7738|CWE-264|https: //github.com/karelzak/util-linux|1.0|5.0|4.0|findmnt is used as output instead of mount, and the use of n as a separator is forced 
CVE-2016-7420|CWE-200|https: //github.com/weidai11/cryptopp|2.0|29.0|9.0|updated readme and install files with DNDEBUG definition 
CVE-2017-16642|CWE-125|https: //github.com/derickr/timelib|2.0|5.0|2.0|Fix parser rule for 'backof' and 'frontof' 
CVE-2015-2320|CWE-295|https: //github.com/mono/mono|1.0|1.0|168.0|Remove the client-side SSLv2 fallback. 
CVE-2018-12466|CWE-264|https: //github.com/openSUSE/open-build-service|1.0|5.0|2.0|a check is added to prevent authenticated users from accessing the project link through which they could delete it 
CVE-2017-7215|CWE-79|https: //github.com/MISP/MISP|2.0|1.0|1.0|sanitation to avoid web or html injection 
CVE-2016-5735|CWE-190|https: //github.com/pornel/pngquant|1.0|6.0|6.0|For overflow safety images that won't fit in 32-bi 
CVE-2012-1902|CWE-200|https: //github.com/phpmyadmin/phpmyadmin|2.0|6.0|1.0|check if the configuration file exists 
CVE-2015-4471|CWE-189|https: //github.com/kyz/libmspack|2.0|9.0|2.0|Prevent 1-byte underread of input buffers if an odd-sized data block just before an uncompressed block header 
CVE-2018-10574|CWE-94|https: //github.com/bigtreecms/BigTree-CMS|1.0|1.0|1.0|Rejecting htaccess 
CVE-2016-5353|CWE-20|https: //github.com/wireshark/wireshark|1.0|4.0|4.0|add the modulus 0xf to avoid running off the end of the table.
CVE-2015-3010|CWE-200|https: //github.com/ceph/ceph-deploy|2.0|52.0|46.0|strengthened permissions to access files 
CVE-2017-17439|CWE-476|https: //github.com/heimdal/heimdal|1.0|5.0|3.0|Avoid NULL structure pointer member dereference 
CVE-2018-15856|CWE-399|https: //github.com/xkbcommon/libxkbcommon|1.0|1.0|1.0|fix infinite loop with eof 
CVE-2018-1000201|CWE-426|https: //github.com/ffi/ffi|1.0|1.0|3.0|Do not treat Symbol args different to Strings in ffi_lib 
CVE-2016-5688|CWE-119|https: //github.com/ImageMagick/ImageMagick|1.0|6.0|3.0|Ensure image extent does not exceed maximum to avoid heap based buffer overflow 
CVE-2014-8483|CWE-125|https: //github.com/quassel/quassel|1.0|10.0|1.0|Check for invalid input in encrypted buffers 
CVE-2011-4312|CWE-79|https: //github.com/reviewboard/reviewboard|3.0|9.0|2.0|that the text is escaped to the point where it is fed into the javascript to avoid web injection 
CVE-2017-15200|CWE-264|https: //github.com/kanboard/kanboard|20.0|112.0|129.0|do not expose id in form 
CVE-2016-3699|CWE-264|https: //github.com/mjg59/linux|2.0|12.0|6.0|Disable ACPI table override if securelevel is set 
CVE-2014-3480|CWE-20|https: //github.com/file/file|1.0|5.0|4.0|Fix incorrect bounds check for sector count 
CVE-2012-4396|CWE-79|https: //github.com/owncloud/core|1.0|1.0|1.0|Sanitize user input with htmlentities to avoid xss 
CVE-2015-8669|CWE-200|https: //github.com/phpmyadmin/phpmyadmin|2.0|2.0|1.0|check that not all file path is detected in an error message 
CVE-2015-8631|CWE-119|https: //github.com/krb5/krb5|1.0|77.0|74.0|In each kadmind server stub, initialize the client_name and server_name variables, and release them in the cleanup handler, Also make sure to free the prime_arg variables in rename_principal_2_svc () 
CVE-2015-1471|CWE-89|https: //github.com/delta/pragyan|1.0|1.0|1.0|added safe_html and escape functions to avoid sql injection 
CVE-2016-10162|CWE-476|https://github.com/php/php-src|2.0|43.0|16.0|fix NULL Pointer Dereference while unserialize php object
CVE-2012-5646|CWE-20|https://github.com/openshift/origin-server|1.0|12.0|6.0|control on uuid in path info to avoid injection commands
CVE-2012-2395|CWE-Other|https://github.com/cobbler/cobbler|3.0|44.0|49.0|check metacharacters in the username and password fields
CVE-2014-4502|CWE-119|https://github.com/ckolivas/cgminer|1.0|41.0|14.0|Do some random sanity checking for stratum message parsing
CVE-2017-15111|CWE-59|https://github.com/jdennis/keycloak-httpd-client-install|1.0|1.0|1.0|/tmp/{prog_name} change in {prog_name} so the log file is created in the current directory instead of under /tmp.
CVE-2017-14242|CWE-89|https://github.com/Dolibarr/dolibarr|7.0|27.0|32.0|check status parameter to avoid sql injection
CVE-2016-5352|CWE-125|https://github.com/wireshark/wireshark|1.0|3.0|1.0|check the lenght value
CVE-2018-6651|CWE-352|https://github.com/chrisd1100/uncurl|1.0|5.0|2.0|origin matching must come at str end
CVE-2018-6656|CWE-352|https://github.com/zblogcn/zblogphp|36.0|0.0|2112.0|all 36 files have been deleted
CVE-2017-5590|CWE-20|https://github.com/ChatSecure/ChatSecure-iOS|3.0|22.0|23.0|Changed to using carbon module delegate methods
CVE-2017-6908|CWE-79|https://github.com/concrete5/concrete5-legacy|1.0|4.0|3.0|added more filters to the data
CVE-2014-3570|CWE-310|https://github.com/openssl/openssl|4.0|379.0|676.0|fix the calculation the square of a BIGNUM 
CVE-2011-0530|CWE-119|https://github.com/yoe/nbd|1.0|2.0|2.0|check size to avoid buffer overflow
CVE-2017-18187|CWE-190|https://github.com/ARMmbed/mbedtls|1.0|2.0|2.0|check size to integer overflow
CVE-2014-3774|CWE-79|https://github.com/nilsteampassnet/TeamPass|10.0|241.0|32.0|increases security measures to avoid bypassing access restrictions
CVE-2016-9393|CWE-Other|https://github.com/mdadams/jasper|1.0|41.0|16.0|Added some missing sanity checks on the data in a SIZ marker segment.
CVE-2016-9283|CWE-89|https://github.com/exponentcms/exponent-cms|1.0|95.0|39.0|fix sql injection security vulnerability which failed to account for sef urls adequately
CVE-2017-14164|CWE-119|https://github.com/uclouvain/openjpeg|1.0|20.0|5.0|fix size to avoid write heap buffer overflow
CVE-2013-4562|CWE-352|https://github.com/mkdynamic/omniauth-facebook|5.0|9.0|20.0|check session parameter to avoid CSRF
CVE-2017-7266|CWE-601|https://github.com/Netflix/security_monkey|5.0|11.0|12.0|replacing flask-security login_user instead of flask-login and Replacing current_user.is_authenticated() method with property
CVE-2015-3905|CWE-119|https://github.com/kohler/t1utils|6.0|77.0|79.0|Cast arguments to <ctype.h> functions to unsigned char
CVE-2016-10065|CWE-284|https://github.com/ImageMagick/ImageMagick|3.0|30.0|4.0|added method checkMemoryOverflow to avoid denial of service
CVE-2017-7579|CWE-79|https://github.com/thorsten/phpMyFAQ|1.0|3.0|3.0|Added missing sanitizing to avoid xss
CVE-2018-14056|CWE-22|https://github.com/znc/znc|1.0|5.0|3.0|Don't let web skin name ../../../../ access  outside of usual skins directories
CVE-2015-2678|CWE-79|https://github.com/semplon/GeniXCMS|39.0|1165.0|528.0|several security fix
CVE-2017-6799|CWE-79|https://github.com/mantisbt/mantisbt|1.0|1.0|1.0|sanitized the value of the view_type parameter before being displayed as a hidden input.
CVE-2014-0072|CWE-20|https://github.com/apache/cordova-plugin-file-transfer|1.0|2.0|2.0|Fix default value for trustAllHosts on iOS
CVE-2012-1208|CWE-79|https://github.com/forkcms/forkcms|1.0|4.0|3.0|added stripHTML to avoid xss
CVE-2016-7565|CWE-284|https://github.com/exponentcms/exponent-cms|1.0|26.0|25.0|security fix to prevent possible hacking by moving security checks earlier in the install code
CVE-2017-5225|CWE-119|https://github.com/vadz/libtiff|2.0|29.0|2.0|check that BitsPerSample != 8 to avoid heap based overflow
CVE-2016-9840|CWE-189|https://github.com/madler/zlib|1.0|8.0|10.0|Remove offset pointer optimization in inftrees.c
CVE-2016-9122|CWE-284|https://github.com/square/go-jose|5.0|148.0|41.0|Improve multi-recipient/multi-sig handling
CVE-2015-9274|CWE-125|https://github.com/harfbuzz/harfbuzz|3.0|17.0|17.0|Add missing returns
CVE-2017-6059|CWE-20|https://github.com/pingidentity/mod_auth_openidc|2.0|5.0|2.0|don't echo query params on invalid requests to redirect URI
CVE-2017-9229|CWE-476|https://github.com/kkos/oniguruma|1.0|17.0|10.0|fix access to invalid address by reg->dmax value
CVE-2014-9621|CWE-399|https://github.com/file/file|1.0|8.0|3.0|Limit string printing to 100 chars
CVE-2015-6250|CWE-200|https://github.com/claviska/simple-php-captcha|1.0|13.0|8.0|Switch from rand to mt_rand
CVE-2018-18206|CWE-190|https://github.com/Bytom/bytom|1.0|1.0|1.0|fix idx can be negative after uint convert to int
CVE-2017-15570|CWE-79|https://github.com/redmine/redmine|1.0|3.0|1.0|Don't use raw output in timelog
CVE-2017-8929|CWE-416|https://github.com/VirusTotal/yara|8.0|115.0|14.0|added function sized_string_dup
CVE-2018-18546|CWE-89|https://github.com/top-think/thinkphp|1.0|13.0|13.0|check the order parameter to avoid sql injection
CVE-2017-10680|CWE-352|https://github.com/Piwigo/Piwigo|4.0|15.0|6.0|adding pwg_token on permalink & cat_options
CVE-2016-10010|CWE-264|https://github.com/openbsd/src|1.0|5.0|3.0|disable Unix-domain socket forwarding when privsep is disabled
CVE-2016-3120|CWE-476|https://github.com/krb5/krb5|2.0|6.0|1.0|use client.princ instead of request->client
CVE-2017-14107|CWE-119|https://github.com/nih-at/libzip|1.0|6.0|1.0|Make eocd checks more consistent between zip and zip64 cases
CVE-2017-12868|CWE-384|https://github.com/simplesamlphp/simplesamlphp|1.0|2.0|2.0|SimpleSAML\Utils\Crypto returns true for different strings
CVE-2012-3382|CWE-79|https://github.com/mono/mono|1.0|1.0|1.0|added htmlEncode in the path
CVE-2017-11665|CWE-20|https://github.com/FFmpeg/FFmpeg|1.0|37.0|20.0|Convert ff_amf_get_field_value() to bytestream2
CVE-2015-1347|CWE-79|https://github.com/osTicket/osTicket|1.0|2.0|1.0|Fix possible vuln setting client lang pref
CVE-2017-1000470|CWE-190|https://github.com/embedthis/goahead|1.0|2.0|2.0|Add integer overflow check for content-length
CVE-2016-7514|CWE-125|https://github.com/ImageMagick/ImageMagick|1.0|87.0|80.0|Rewrite reading pixel values
CVE-2016-7103|CWE-79|https://github.com/jquery/jquery-ui|2.0|8.0|3.0|Escape closeText option before passing it to button
CVE-2015-5659|CWE-89|https://github.com/NaCl-Ltd/pref-shimane-cms|3.0|48.0|2.0|added functions orderby e valid_order_param
CVE-2013-2145|CWE-20|https://github.com/audreyt/module-signature|3.0|18.0|5.0|Constrain algorithm name to be of form ABC123
CVE-2017-9205|CWE-125|https://github.com/jsummers/imageworsener|1.0|25.0|13.0|Fixed invalid memory access bugs when decoding JPEG Exif data
CVE-2014-1869|CWE-79|https://github.com/zeroclipboard/zeroclipboard|2.0|13.0|6.0|Hardening sanitization technique in Flash
CVE-2014-6308|CWE-22|https://github.com/osclass/Osclass|5.0|45.0|18.0|add osc_esc_html to file parameter
CVE-2014-7205|CWE-94|https://github.com/hapijs/bassmaster|1.0|2.0|8.0|Remove eval statement
CVE-2017-0903|CWE-502|https://github.com/rubygems/rubygems|7.0|55.0|5.0|"changes calls to YAML.load to call the whitelisted ""safe"" loader instead"
CVE-2016-5732|CWE-79|https://github.com/phpmyadmin/phpmyadmin|1.0|1.0|1.0|added htmlspecialchars to avoid xss
